source,title,datepub,article,link,summary,zh_summary
tagesschau,Starkregen zieht über Osten und Nordosten,2025-07-21T14:48:40.190Z,"Es drohen Überflutungen, Erdrutsche und Aquaplaning: Der Deutsche Wetterdienst warnt für den Osten und den Nordosten Deutschlands vor extremen Regenfällen. Erste Auswirkungen sind bereits in Sachsen und Berlin zu spüren.
Nach dem sonnigen Wochenende warnt der Deutsche Wetterdienst (DWD) vor heftigen Regenfällen im Osten und Nordosten Deutschlands. Betroffen sind demnach Teile Sachsens, Brandenburgs, Mecklenburg-Vorpommerns und Berlins.
Für Gebiete zwischen Rostock und Stralsund beziehungsweise Teilen der Ostseeinsel Rügen rief der Wetterdienst sogar die höchste Warnstufe aus: Gewarnt wurde vor extrem ergiebigem Regen. Der Wetterdienst rechnet mit Regenmengen zwischen 80 und 140 Liter pro Quadratmeter innerhalb von bis zu zwölf Stunden.
Gegenüber der Nachrichtenagentur dpa sagte ein DWD-Sprecher, die erwartete Höchstmenge entspreche dem Niederschlag der Flutkatastrophe im Ahrtal. Diese Menge würde laut dem Sprecher in etwa dem doppelten der dort üblichen Menge für den ganzen Monat Juli entsprechen. ""In der Nacht kommt ein riesiger Schwal"", so der Sprecher. Wegen der fehlenden Berge - anders als im Ahrtal - werde das Wasser aber besser abfließen.
In anderen betroffenen Gebieten in den vier Bundesländern wird etwas weniger Niederschlag erwartet. Dennoch könnten es laut Prognose bei ergiebigem Dauerregen bis zu 70 Liter pro Quadratmeter sein.
Der Wetterdienst warnte, bei starken Regenfällen könne es zu raschen Überflutungen von Straßen, Unterführungen und Kellern sowie zu Aquaplaning kommen. Auch Erdrutsche seien möglich. Autofahrer sollten vorsichtig fahren. Es bestehe Gefahr für Leib und Leben. Bei Hochwasser oder bereits drohenden Überflutungen sollten Keller sofort verlassen werden.
Der Starkregen soll sich gebietsweise bis in den Dienstagnachmittag ziehen.
Erste Auswirkungen der heftigen Regenfälle spürten bereits etwa die Menschen im sächsischen Vogtland. Hier ist die Autobahn 72 wegen Überschwemmungen zeitweise gesperrt worden.
Zwischen Reichenbach und Treuen gebe es Überflutungen auf den Fahrbahnen in beide Richtungen, teilte der Verkehrswarndienst der Polizei mit. Vorübergehend war die A72 Richtung Zwickau ganz blockiert; anschließend blieb noch die linke Spur gesperrt.
In Berlin ist das für den Montagabend geplanteOpen-Air-Konzert von Robbie Williams wetterbedingt verschobenworden. Wegen der akuten Wetterlage könne das Konzert nicht wie geplant stattfinden, teilte der Veranstalter mit. Der Auftritt werde aber bereits am Mittwoch nachgeholt, die Tickets behalten ihre Gültigkeit. Die Sicherheit habe oberste Priorität, erklärte der Konzertveranstalter.
Ausfallen muss auch das Konzert von Opernsängerin Anna Netrebko, das auf dem Gendarmenmarkt geplant war. Ob es hierfür einen Ersatztermin gibt, soll in Kürze bekannt gegeben werden, so der Veranstalter.
In Mecklenburg-Vorpommern stellen sich die Kreise auf das erwartete Extremwetter ein. Nach Aussage dortiger Sprecher werden etwa Leitstellen in Rostock, im Landkreis Vorpommern-Greifswald und an der Mecklenburgischen Seenplatte verstärkt. Die Kreise rechnen lokal mit Überflutungen und volllaufenden Kellern.
Der Landkreis Vorpommern-Greifswald empfahl, gegebenenfalls vorbeugend Hochwasser-Schutzmaßnahmen zu treffen. Ein Sprecher der Stadt Rostock sagte, man habe die Bevölkerung über die eigene Warn-App informiert.",https://www.tagesschau.de/inland/unwetterwarnung-starkregen-100.html,"Extreme Regenfälle im Osten und Nordosten Deutschlands – Überflutungen und Verkehrsbehinderungen
Der Deutsche Wetterdienst (DWD) warnt vor extremen Regenfällen in Ost- und Nordostdeutschland, insbesondere in Sachsen, Brandenburg, Mecklenburg-Vorpommern und Berlin. In einigen Regionen, darunter Rostock, Stralsund und Teile der Insel Rügen, gilt die höchste Warnstufe. Es werden Niederschlagsmengen von bis zu 140 Litern pro Quadratmeter innerhalb von zwölf Stunden erwartet – vergleichbar mit den Mengen der Ahrtal-Flutkatastrophe.
Erste Auswirkungen zeigen sich bereits: Im sächsischen Vogtland ist die A72 wegen Überflutungen teilweise gesperrt. In Berlin wurden Open-Air-Konzerte von Robbie Williams und Anna Netrebko verschoben bzw. abgesagt. Die Behörden in Mecklenburg-Vorpommern bereiten sich auf mögliche Überflutungen und volllaufende Keller vor. Die Stadt Rostock hat die Bevölkerung via Warn-App informiert.
Der DWD warnt vor lebensgefährlichen Bedingungen durch Aquaplaning, Erdrutsche und schnelle Überflutungen von Straßen und Kellern. Der Starkregen soll bis Dienstagnachmittag anhalten. Sicherheitsmaßnahmen haben Priorität, wie die Absage von Großveranstaltungen zeigt.","【环境】
德国东部及东北部遭遇强降雨 多地发生洪涝及交通中断
德国气象局（DWD）针对东部及东北部地区发布极端降雨预警，萨克森州、勃兰登堡州、梅前州及柏林市受影响尤为严重。罗斯托克、施特拉尔松德和吕根岛部分区域已启动最高级别警报，预计12小时内降水量最高将达140升/平方米，堪比2021年阿尔河谷洪灾水平。
灾情初步显现：萨克森州福格特兰地区A72高速公路因积水部分封闭；在柏林，罗比·威廉姆斯和安娜·奈瑞贝科的露天演唱会被迫延期或取消。罗斯托克市正通过预警应用程序通知居民防范地下室进水风险，并部署防洪准备。
气象部门警告，道路积水、山体滑坡及车辆打滑可能危及生命，强降雨将持续至周二下午。基于安全第一的考虑，多项大型活动因此取消。"
tagesschau,Große Summe für ein großes Ziel,2025-07-21T16:49:20.658Z,"Mit Milliarden-Investitionen wollen Unternehmen die Wirtschaft in Deutschland ankurbeln. Kanzler Merz spricht bereits von einem Stimmungswechsel. Die Konzerne drängen auf zügige Reformen.
Zurück an die Spitze der Weltwirtschaft: Dieses gemeinsame Ziel haben die Bundesregierung und die Konzerne in Deutschland. Um es zu erreichen, gab es heute einen Investitionsgipfel im Bundeskanzleramt. Der Name des Treffens sagt es schon: Es ging um sehr viel Geld - und eine ganz neue Zusammenarbeit zwischen Wirtschaft und Politik.
Sichtlich zufrieden und optimistisch stellten sich nach dem Treffen die Chefs von Siemens und Deutscher Bank links und rechts neben Bundeskanzler Friedrich Merz zum Pressestatement auf. Nach den sinkenden Wirtschaftsprognosen stünden die Zeichen auf Wachstum, betonten sie mehrfach. Diesen Aufschwung wolle das Bündnis""Made for Germany""mitgestalten. Der Initiative gehören 61 Unternehmen verschiedener Branchen und Investmentfirmen an - einige von ihnen nahmen auch an dem Treffen teil.
Deutschland habe alles, was man braucht, zum Beispiel um Vorreiter in Sachen Künstlicher Intelligenz zu werden, sagte Siemens-Chef Roland Busch. Neben den Datensätzen auch das Know-How der Menschen. Aber die Umstände und Strukturen würden eben noch nicht passen, es brauche ein neues Betriebssystem, ein Update. Zu Reformen, erklärte Christian Sewing, der Vorstandsvorsitzende der Deutschen Bank, habe man den Bundeskanzler noch einmal ermuntert.
""Ermuntert"" - das heißt aus Sicht der Initiative ""Made for Germany"": Die Unternehmen stellen bis 2028 Investitionen von 631 Milliarden Euro in Aussicht. Damit übertrifft das Bündnis den 500 Milliarden schweren ""Investitionsbooster"" der Bundesregierung, der vergangene Woche für den Wirtschaftsaufschwung beschlossen wurde. Es sei klar, dass der Großteil der Investitionen in die Wirtschaft aus dem Privatsektor kommen müsste, betonte Bundeskanzler Merz nochmal.
Dafür wollen die Unternehmen, dass die Pläne im Koalitionsvertrag jetzt auch schnell angegangen werden. Merz sagte, ihm sei klar, dass es bei so hohen Investitionen auch Erwartungen an die Politik gebe. Er wolle die Strukturreformen angehen und sich in regelmäßigen Abständen mit dem Bündnis treffen. Das nächste Treffen soll es Ende diesen oder Anfang nächsten Jahres geben. Zwischendurch seien auch immer wieder kurze Meetings zum Austausch im kleinen Rahmen möglich.
Die Botschaft des Investitionsgipfels im Kanzleramt fasste Merz so zusammen: ""Deutschland ist zurück."" Er sprach von einem Stimmungswechsel, den man verstetigen müsse. Die Milliarden-Investitionen seien auch ein Vertrauensbeweis in den Wirtschaftsstandort Deutschland, und in die Mitarbeiterinnen und Mitarbeiter in den Betrieben, sagte Merz.
Das sehen nicht alle so. Es gab viel Kritik daran, dass der Mittelstand kaum oder gar nicht vertreten sei. Der Linken-Co-Chef Jan van Aken sagte vor dem Gipfel, wenn Merz glaube, mit den zehn größten Konzernen etwas ausdealen zu können und zu denken, es nütze auch dem Mittelstand, dann habe Merz von der Wirtschaft in Deutschland gar nichts verstanden.
Der Präsident des Wirtschaftsforschungsinstituts ifo, Clemens Fuest, will erst abwarten, ob sich die Investitionen nicht als Strohfeuer herausstellen und erkennt in der Initiative ""Made for Germany"" vor allem Werbung für die Unternehmen. Er und andere Wirtschaftsexperten fordern, auch den Mittelstand miteinzubeziehen. Gerade beim Bürokratieabbau sei der Mittelstand wichtig, so Fuest.
Kritiker sehen zudem eine medienwirksame Bündelung bei den Investitionen. Die bisherige Summe von 631 Milliarden Euro umfasst laut der Initiative sowohl bereits geplante als auch neue Kapitalinvestitionen, Ausgaben für Forschung und Entwicklung sowie Zusagen internationaler Investoren.",https://www.tagesschau.de/inland/innenpolitik/investitionsgipfel-kanzleramt-unternehmen-100.html,"Milliarden-Investitionen und Reformforderungen: Wirtschaftsbündnis „Made for Germany“ will Aufschwung gestalten
Am 21. Juli 2025 fand im Bundeskanzleramt ein Investitionsgipfel statt, bei dem die Bundesregierung unter Kanzler Friedrich Merz und führende Konzerne wie Siemens und die Deutsche Bank eine engere Zusammenarbeit vereinbarten, um Deutschlands Wirtschaft anzukurbeln. Das Bündnis „Made for Germany“, bestehend aus 61 Unternehmen und Investmentfirmen, kündigte Investitionen von 631 Milliarden Euro bis 2028 an – deutlich mehr als der 500-Milliarden-„Investitionsbooster“ der Regierung.
Siemens-Chef Roland Busch und Deutsche-Bank-Vorstand Christian Sewing betonten Deutschlands Potenzial, etwa in KI, forderten aber strukturelle Reformen wie Bürokratieabbau und ein „Update“ der Wirtschaftspolitik. Merz signalisierte Bereitschaft zu regelmäßigen Treffen und Reformen, verwies jedoch auf die primäre Verantwortung des Privatsektors für Investitionen.
Kritik kam von Linken-Co-Chef Jan van Aken und ifo-Präsident Clemens Fuest, die die fehlende Einbindung des Mittelstands monierten. Fuest warnte zudem vor einem „Strohfeuer“ und betonte, die angekündigten Summen umfassten teils bereits geplante Projekte. Merz hingegen wertete die Investitionen als „Vertrauensbeweis“ und sprach von einem „Stimmungswechsel“. Das nächste Treffen ist für Ende 2025 oder Anfang 2026 geplant.","【经济】
“德国制造”联盟宣布投资6310亿欧元投资，政企合力推动经济复苏
2025年7月21日，德国总理默茨在总理府召开投资峰会，与西门子、德意志银行等龙头企业达成紧密合作共识，旨在重振德国经济。由61家企业和投资机构组成的“德国制造”联盟宣布，计划到2028年投入6310亿欧元，远超政府此前提出的5000亿欧元“投资助推计划”。
西门子CEO罗兰·布施和德意志银行董事克里斯蒂安·泽温强调德国在人工智能等领域的潜力，但呼吁推进减少官僚主义、更新经济政策等结构性改革。默茨表示愿定期会晤并推动改革，同时强调私营部门应承担投资主体责任。
左翼党联合主席扬·范·阿肯和ifo经济研究所所长克莱门斯·富斯特批评该计划未纳入中小企业。富斯特警告投资存在“昙花一现”风险，指出部分资金实为既有项目。默茨则称此举表明对德国经济的信心，也预示着“情绪转变”。下次峰会拟于今年年底或明年年初举行。"
tagesschau,Klimaschutzpolitik der Bundesregierung: Wie grün ist Schwarz-Rot?,2025-07-22T08:19:57.210Z,"An Versprechen zum Klimaschutz mangelt es nicht, aber die Umsetzung ist unklar. Differenzen zwischen dem CDU-Wirtschaftsministerium und dem SPD-Umweltministerium zeichnen sich bereits ab.
Beim Klimaschutz ergibt sich ein gemischtes Bild, was die neue Bundesregierung aus Union und SPD angeht. Die Dringlichkeit scheint zwar angekommen zu sein: ""Im 21. Jahrhundert kann man keine seriöse Politik mehr machen ohne Klimaschutz"", sagte die neue SPD-Vorsitzende Bärbel Bas in ihrer Antrittsrede beim Parteitag. Bundeskanzler Friedrich Merz (CDU) vergaß in seinen bisherigen Regierungserklärungen nicht, den Klimaschutz zumindest kurz zu erwähnen. SPD-Finanzminister Lars Klingbeil versprach jüngst im Bundestag Rekordinvestitionen in die Deutsche Bahn im aktuellen Bundeshaushalt.
""Das, was wir heute nicht in den Klimaschutz investieren, das zahlen wir morgen doppelt. Und deswegen ist es richtig, dass wir jetzt so viel Geld für den Klimaschutz in die Hand nehmen"", betonte Klingbeil. Im bis zu 500 Milliarden Euro schweren neuen Sondervermögen für Infrastruktur und Klimaneutralität sind über die nächsten Jahre 100 Milliarden Euro dem Klimaschutz zugewidmet.
So erhält der Klima- und Transformationsfonds (KTF) jährlich ab diesem Jahr 10 Milliarden Euro mehr aus dem schuldenfinanzierten Sondervermögen. Er fördert unter anderem erneuerbare Energien im Gebäudesektor, die Transformation der Industrie oder klimafreundliche Mobilität.
Die Grünen kritisieren, dass neuerdings die Gasspeicherumlage aus dem KTF finanziert werden soll und nennen dies ""Zweckentfremdung"". Damit entfällt die Umlage für Verbraucher, doch der schuldenfinanzierte Fonds muss jetzt auch zu dieser Vergünstigung fossiler Energie herhalten.
Es gilt viel aufzuholen beim Klimaschutz, auch für dieses schwarz-rote Bündnis - das weiß man im SPD-geführten Umweltministerium:""Das ist eine riesengroße Gemeinschaftsaufgabe"", sagte Umweltstaatssekretär Jochen Flasbarth im ARD-Morgenmagazin, dazu brauche es mehr Anstrengungen.
Gerade erst hat der unabhängigeExpertenrat für Klimafragengemahnt, dass ab 2030 klimaschädliche Emissionen in großem Umfang aus dem Ruder laufen werden: ""Für die Jahre nach 2030 zeigen die Projektionsdaten eine deutliche und im Zeitverlauf zunehmende Zielverfehlung"", heißt es in ihrem Bericht.
Das Gremium sprach mahnende Worte an die Regierung Merz aus: ""Vom Koalitionsvertrag geht kein nennenswerter Impuls für die Zielerreichung im Jahr 2030 aus"", stellt die stellvertretende Vorsitzende Brigitte Knopf fest. ""Zudem adressiert derKoalitionsvertragdie maßgeblichen Problemfelder nicht explizit und bleibt an vielen Stellen vage."" Man empfehle daher, das anstehende Klimaschutzprogramm neben der Sicherstellung der Zielerreichung für das Jahr 2030 ""auch explizit auf die identifizierten Handlungsfelder und die langfristige Erreichbarkeit der Klimaneutralität auszurichten.""
Von der Ausgestaltung des Klimaschutzprogrammes, das Umweltminister Carsten Schneider (SPD) ressortübergreifend federführend erarbeiten und im Herbst vorlegen will, werde vieles abhängen, sagt Klimawissenschaftlerin Knopf im Gespräch mittagesschau.de. Im Verkehrs- und Gebäudesektor hinke Deutschland hinterher.
Knopf, die dem Think Tank ""Zukunft KlimaSozial"" vorsteht, nimmt eine unterschiedliche Positionierung zum Klimaschutz innerhalb der schwarz-roten Koalition wahr. Umweltminister Schneider gehe bereits bei einigen Themen in Widerspruch zu Wirtschaftsministerin Katherina Reiche (CDU). Die relevante Frage sei, ob es einen wirklichen Einstig in den Ausstieg aus der Gasnutzung gebe oder eine langgezogene Brücke, urteilt Knopf. Wichtig sei auch die Verknüpfung von Klimaschutzpolitik mit sozialem Ausgleich für einkommensschwache Gruppen, wie etwa Sozial-Leasing für Elektro-Autos.
Säumig ist die Bundesregierung gegenüber Brüssel beim Klimasozialplan - der konkreten Umsetzung des EU-Klimasozialfonds. Den hätte sie bis Ende Juni vorlegen müssen. Das Umweltministerium sagt dazu, es brauche noch mehr Zeit, auch ""um sich mit Umwelt-, Sozial- und Verbraucherschutzverbänden abzustimmen"". Ein konkretes ""Klimageld"" sieht der Koalitionsvertrag von Schwarz-Rot nicht vor, spricht aber von sozialem Ausgleich für Klimaschutzmaßnahmen, auch beim KTF.
Eszeichnen sich bereits Ressortkonflikte zwischen Wirtschafts- und Umweltministerium ab. Gleich in ihrer ersten Woche als neue Wirtschaftsministerin modifizierte Reiche ein Ziel des Koalitionsvertrages gerade beim Bau neuer Gaskraftwerke. Im gemeinsamen Vertrag heißt es deutlich, man wolle den Bau ""von bis zu 20 Gigawatt (GW) an Gaskraftwerksleistung bis 2030 wollen wir im Rahmen einer zügig zu überarbeitenden Kraftwerksstrategie technologieoffen anreizen"".
Im Gegensatz zur SPD definierte Reiche das für sich als mögliches Minimum um. Es sei wichtig, ""dass wir ganz schnell in die Ausschreibung von mindestens 20 Gigawatt Gaskraftwerken gehen, um die Versorgungssicherheit in unserem Land hochzuhalten"". Um dies auch hinsichtlich der Kosten realisieren zu können, brauche es ""langfristige Gaslieferverträge"" und einen Realitätscheck der Energiewende.
SPD-Fraktionschef Matthias Miersch hatte bereits zu Regierungsbeginn wiederum den Koalitionspartner Union vor einem Kurswechsel gewarnt: ""Die Energiewende muss bleiben"", betonte Miersch, gerade der Ausbau der Erneuerbaren dürfe nicht in irgendeiner Form behindert, die Abkehr von Öl, Gas und Atomenergie nicht infrage gestellt werden.""
Der Bundesverband für Erneuerbare Energien (BEE) reagierte auf Reiches Vorstoß mit scharfen Widerworten: ""Statt von Anfang an ein auf Erneuerbare Energien ausgelegtes System zu schaffen, drohen neue Überkapazitäten an fossilen Gaskraftwerken und ein fossiler Lock-in mit hohen volkswirtschaftlichen Kosten."" Angesichts steigender CO2-Preise hätten rein fossile Gaskraftwerke nur eine kurze Phase der Rentabilität, bevor sie zu wertlosen Investitionen würden"", kritisierte die BEE-Präsidentin und frühere Grünen-Co-Chefin Simone Peter.
Die Bundesregierung plant die neuen Gaskraftwerke in größerem Umfang, ohne dass bisher klar ist, ob sie auf spätere Wasserstoffproduktion umrüstbar sein werden. So hatte es ein Gesetzesentwurf der vorigen Koalition aus SPD, Grünen und FDP zurKraftwerksstrategie vorgesehen, der aber durch das vorzeitige Scheitern der Ampelkoalition nicht mehr zum Zuge kam.
Für Claudia Kemfert, Energieökonomin am Deutschen Institut für Wirtschaftsforschung (DIW), stellt sich die Frage nach der ""Ernsthaftigkeit der Koalition beim Klimaschutz"". Gas werde weiter als Brückentechnologie behandelt, obwohl das rettende Ufer längst erreicht sei. ""Der Ausbau Erneuerbarer Energien sollte prioritär sein"", sagt Kemfert im Gespräch mittagesschau.de. Die Märkte würden das bereits vormachen.
Wirtschaftsministerin Reichesorgte kürzlich beim Tag der Industrie mit einer Aussage zu Klimaziele für Verwirrung. Sie wies darauf hin, dass das Erreichen der Klimaschutzziele bis 2045 absolut ambitioniert sei - eine Position, die der Bundesverband der Deutschen Industrie (BDI) teilt. ""Eine Harmonisierung mit internationalen Zielen täte gut"", sagte Reiche und säte damit Zweifel, ob sie hinter dem Klimaziel wirklich steht. Im Nachhinein bekannte sie sich jedoch zu Deutschlands Ziel, bis 2045 klimaneutral zu sein, wie es im Koalitionsvertrag steht.
Reiche fällt mit eher kritischen Aussagen zum Ausbau Erneuerbarer Energien jedenfalls auf, anders als der Umweltminister: ""Wir brauchen eine Art Monitoring und Sich-Ehrlich-Machen über den Stand der Energiewende"", befindet Reiche. Dieses Monitoring hat sie in Auftrag gegeben. Sie strebt einen Kurswechsel bei der Energiewende an: ""Die Kosten müssen insgesamt runter"", sagte sie der Nachrichtenagentur dpa.
Das Handelsblatt hat bereits einen ""Machtkampf"" der beiden Häuser identifiziert. Ob sich daraus ein harmonisches Miteinander mit ihrem Ministerkollegen für Umwelt und Klimaschutz ergibt - oder eher ein Dauerkonflikt, muss sich noch zeigen.",https://www.tagesschau.de/inland/innenpolitik/klimaschutz-schwarz-rot-100.html,"Klimaschutz in der schwarz-roten Koalition: Zwischen Ambitionen und Ressortkonflikten
Die deutsche Bundesregierung aus Union und SPD zeigt zwar rhetorische Entschlossenheit beim Klimaschutz, steht jedoch vor erheblichen Umsetzungsproblemen und internen Differenzen. Während SPD-Politiker wie Finanzminister Lars Klingbeil Rekordinvestitionen in klimafreundliche Infrastruktur (u.a. 100 Mrd. Euro aus einem 500-Mrd.-Euro-Sondervermögen) betonen, kritisiert der Expertenrat für Klimafragen die unklaren Maßnahmen für die Zeit nach 2030. Umweltminister Carsten Schneider (SPD) soll bis Herbst 2025 ein ressortübergreifendes Klimaschutzprogramm vorlegen, das insbesondere die Defizite im Verkehrs- und Gebäudesektor adressiert.
Konflikte zeichnen sich zwischen dem SPD-geführten Umweltministerium und dem CDU-Wirtschaftsressort ab: Wirtschaftsministerin Katherina Reiche (CDU) pocht auf den Bau von mindestens 20 GW Gaskraftwerken bis 2030 – entgegen der SPD-Forderung nach rascher Abkehr von fossilen Energien. Der Bundesverband Erneuerbare Energien (BEE) warnt vor fossilen „Lock-in-Effekten“. Zudem verzögert sich die Umsetzung des EU-Klimasozialfonds, während soziale Ausgleichsmechanismen wie „Klimageld“ unkonkret bleiben.
Klimawissenschaftlerin Brigitte Knopf (Expertenrat) mahnt, der Koalitionsvertrag bleibe „vage“ und adressiere Schlüsselprobleme nicht. Energieexpertin Claudia Kemfert (DIW) zweifelt an der Ernsthaftigkeit der Klimapolitik, da Gas weiter als Brückentechnologie behandelt werde. Reiches jüngste Aussagen zur „Harmonisierung“ internationaler Klimaziele sorgten für Irritationen, obwohl sie sich später zum 2045-Ziel bekannte.","【环境】
德国执政联盟气候政策：雄心与现实困境
德国由联盟党与社民党组成的联邦政府虽在气候保护方面言辞坚决，却面临重大执行障碍与内部分歧。德国财政部长拉尔斯·克林贝尔（社民党）强调将投入大规模资金（包括从5000亿欧元特别基金中拨出1000亿欧元）建设气候友好型基础设施，但气候问题专家委员会批评2030年后措施模糊。德国环境部长卡斯滕·施奈德（社民党）计划于2025年秋季前提交跨部门气候保护计划，重点解决交通与建筑领域排放缺口。
社民党主导的环境部与联盟党掌控的经济部矛盾凸显：德国经济部长卡特琳娜·赖歇（基民盟）主张尽快招标建设至少20吉瓦天然气发电站，偏离社民党快速淘汰化石能源的目标。德国可再生能源协会警告此举将导致化石能源“锁定效应”。欧盟气候社会基金落实延迟，而“气候津贴”等社会补偿机制仍无细则。
气候科学家布里吉特·克诺夫（专家委员会成员）批评联合政府协议“含糊其辞”，未触及核心问题。能源专家克劳迪娅·肯弗特（德国经济研究所）质疑政策严肃性，因天然气仍被视作过渡技术。赖歇近期关于“协调”国际气候目标的言论引发争议，尽管其事后重申2045碳中和目标。"
