source,title,datepub,article,link,summary,zh_summary
tagesschau,Sozialabgaben bald bei 50 Prozent?,2025-07-10T03:04:28.998Z,"Schon heute fließen rund 42 Prozent des Bruttoeinkommens in die Sozialkassen. Die Abgabenlast dürfte in den kommenden Jahren noch deutlich steigen, warnt der Wirtschaftsweise Werding - und mahnt Reformen an.
Der Wirtschaftsweise Martin Werding rechnet damit, dass die Sozialabgaben in Deutschland zusammengerechnet auf 50 Prozent des Bruttoeinkommens steigen werden. ""Die aktuelle Entwicklung ist atemberaubend. Die Frage ist nicht, ob die Beitragssätze irgendwann 50 Prozent erreichen, sondern wann das geschieht"", sagte Werding derRheinischen Post.
Wegen der Alterung der Bevölkerung halte dieser Aufwärtstrend ohne Reformen in den 2030er-Jahren unverändert an, prognostiziert Werding. Bereits für das Jahr 2026 erwarte der Professor für Sozialpolitik und öffentliche Finanzen die nächste Beitragserhöhung bei den Krankenkassen, ""2027 oder spätestens 2028"" dann auch bei den Rentenkassen.
Aktuell betragen die Sozialabgaben, die in der Regel je zur Hälfte von Arbeitgeber und Arbeitnehmer getragen werden, zusammengerechnet rund 42 Prozent des Bruttoeinkommens. Werding erwartet, dass sie im Laufe des Jahres auf 43 Prozent steigen. Er verwies darauf, dass eine ganze Reihe von Krankenkassen im Durchschnitt die 17-Prozent-Marke geknackt und dazu die Zusatzbeiträge in diesem Jahr bereits wieder angehoben hätten. ""Aktuell dürfte der Durchschnitt bei 17,5 Prozent liegen.""
Auch in der Pflegeversicherung sei zum Jahreswechsel mit einer neuerlichen Anhebung zu rechnen. Später sei auch die Rentenkasse betroffen: Spätestens 2028 würden die Beiträge, die lange Zeit bei 18,6 Prozent konstant geblieben sind, sprunghaft auf annähernd 20 Prozent steigen. Damit sei bis zum Ende dieser Legislaturperiode eine Abgabenbelastung von 45 Prozent in Sicht.
Werding forderte umfassende Reformen: Aktuell diskutierte Maßnahmen wie Anhebungen von Beitragsbemessungsgrenzen sowie Einbeziehung von Beamten in die Sozialversicherungen reichten nicht aus. ""Teilweise reißt es einfach Löcher an anderer Stelle auf - etwa in den Haushalten der Länder, die die Mehrzahl der Beamten beschäftigen"", so Werding.
Nötig seien deshalb Diskussionen über Ausgabenentwicklung, Zielgenauigkeit bestehender Leistungen sowie aktuelle Pläne. Dazu gehöre beispielsweise dieMütterrente. Auch müsse über die Effizienz von Gesundheitsversorgung und Pflege debattiert werden.
Werding ist seit September 2022 Mitglied des Sachverständigenrats Wirtschaft - den so genannten Wirtschaftsweisen. Seit 2008 ist er Professor für Sozialpolitik und öffentliche Finanzen an der Ruhr-Universität Bochum. Vor der Bundestagswahl 2021 stellte Werding eine Studie zum Konzept der sogenannten Aktienrente der FDP vor.",https://www.tagesschau.de/inland/innenpolitik/wirtschaftsweiser-sozialabgaben-100.html,"Steigende Sozialabgaben in Deutschland
Professor für Sozialpolitik und öffentliche Finanzen an der Ruhr-Universität Bochum, Martin Werding warnt vor einem deutlichen Anstieg der Sozialabgaben in Deutschland, die aktuell bereits rund 42 Prozent des Bruttoeinkommens ausmachen. Ohne Reformen könnten sie in den 2030er-Jahren auf 50 Prozent steigen. Werding sieht aufgrund der alternden Bevölkerung einen ungebremsten Aufwärtstrend. Für 2026 prognostiziert er höhere Krankenkassenbeiträge, gefolgt von Rentenkassenerhöhungen 2027 oder 2028.
Aktuell liegen die Sozialabgaben – je zur Hälfte von Arbeitgebern und Arbeitnehmern getragen – bei etwa 42 Prozent, wobei die Krankenkassenbeiträge im Schnitt bereits 17,5 Prozent erreichen. Zusätzlich werden Anhebungen in der Pflegeversicherung und später in der Rentenversicherung erwartet, sodass die Abgabenlast bis 2028 auf etwa 45 Prozent klettern könnte.
Werding kritisiert, dass geplante Maßnahmen wie die Erhöhung von Beitragsbemessungsgrenzen oder die Einbeziehung von Beamten in die Sozialversicherungen nicht ausreichen. Stattdessen fordert er grundlegende Reformen, etwa in der Ausgabenpolitik, der Zielgenauigkeit von Sozialleistungen und der Effizienz von Gesundheits- und Pflegesystemen. Als Mitglied des Sachverständigenrats Wirtschaft betont er die Dringlichkeit struktureller Anpassungen, um die Belastung für Bürger und Wirtschaft zu begrenzen.","【经济】
德国社保缴费率或将升至50% 专家呼吁结构性改革
德国经济专家委员会成员、波鸿鲁尔大学教授马丁·韦尔丁警告称，因人口老龄化，当前占国民总收入42%的社会保险缴费，可能在2030年攀升至50%。他指出，若无改革措施，2026年将首先提高医保费率，2027或2028年将上调养老保险费率。
目前，社会保险缴费一般由雇主和雇员各承担一半，总额约为税前收入的42%，医保平均费率已达17.5%，叠加护理保险和养老保险的预期上调，2028年总费率或达45%。
韦尔丁批评提高缴费上限、将公务员纳入社保体系等计划措施力度不足，强调必须通过优化支出政策、精准社会福利投放、提升医疗护理系统效率等根本性改革实现结构性调整。作为政府经济顾问，他警示现行政策将加剧民生与经济负担，改革已迫在眉睫。"
tagesschau,Warum der 'Bau-Turbo' umstritten ist,2025-07-10T06:58:17.204Z,"Deutschland braucht mehr bezahlbaren Wohnraum. Die Bundesregierung will, dass Bauprojekte künftig schneller umgesetzt werden - ohne langwierige bürokratische Verfahren. Doch die Kritik daran wird lauter.
Katalin Gennburg hat unkonventionelle Vorstellungen, was das Wohnen angeht. Die Linken-Politikerin sieht zum Beispiel Hausbesetzungen als legitimes Mittel, um für mehr Wohnraum zu sorgen. Gennburg ist die neue baupolitische Sprecherin der Linken im Bundestag und sieht den ""Bau-Turbo"" kritisch.
Ihre Hauptsorge: Schnellere Verfahren in den Ämtern könnten für weniger Mitbestimmung sorgen. ""Hier wird die Axt angelegt an demokratische Beteiligung in der räumlichen Planung. Eine große Errungenschaft im Nachkriegsdeutschland, dass wir gesagt haben: Wir bauen diese Republik mit den Menschen. Und darauf beharre ich, ich fordere das ein.""
Der ""Bau-Turbo"" sieht vor, dass weniger Zeit vergeht zwischen dem Bauantrag und dem tatsächlichen Start eines Bauprojekts: nur noch zwei Monate statt wie bisher in manchen Städten fünf Jahre. Zünden muss diesen ""Turbo"" die Gemeinde. Sie kann dann darauf verzichten, Bebauungspläne zu erstellen. Was bedeutet: Anwohner haben weniger Zeit, Einspruch gegen ein Bauprojekt einzulegen.
""Wir sehen, dass die Beschneidung von Bürgerbeteiligung ein riesiges Problem ist. Weil die Menschen gerade die Demokratie vermissen. Das heißt, sie brauchen eigentlich mehr Beteiligung und nicht weniger"", sagt Gennburg. Ein Kritikpunkt, den auch die Grünen im Bundestag formulieren.
Bundesbauministerin Verena Hubertz lässt ihn allerdings nicht gelten. Aus Sicht der SPD-Politikerin bleibt genügend Zeit für Bürgerbeteiligung, wenn für ein Bauprojekt schon nach zwei Monaten die entscheidende Phase beginnt. ""Hier wird keine Beteiligung außen vor gelassen. Das können die Städte, die Gemeinden auch ganz konkret für sich vor Ort beschließen. Wichtig ist nur: Diese Dinge dürfen nicht bis ins Ultimo getrieben werden.""
Bürgerbeteiligung nicht bis ins Ultimo: Worte der Ministerin, in denen vor allem der Wunsch nach Bau-Tempo steckt - und weniger der nach Anwohner-Debatten.
Das sorgt auch bei Umweltschützern für Unverständnis. Stefan Petzold vom Naturschutzbund NABU sorgt sich darum, dass künftig in ""Turbo""-Geschwindigkeit Grünflächen verschwinden könnten, gerade in größeren Städten, wenn der Neubau Priorität bekommt und die Möglichkeiten des Einspruchs weniger werden. Für Petzold sind Wälder und Parkanlagen entscheidend für das Klima. Er erinnert an die Hitzewelle Anfang des Monats.
""Nur mit Grünflächen schaffen wir es, solche Hitzeereignisse abzupuffern. Weil diese Grünflächen eine aktive Kühlung betreiben"", sagt Petzold. ""Jeder, der in den Stadtwald geht, merkt sofort: Hier ist es direkt acht, zehn Grad kühler als auf den Straßen drumherum. Weil Materialien wie Beton und Asphalt die Hitze enorm speichern.""
Der NABU verweist darauf, dass fast zwei Millionen Wohnungen in Deutschland leerstehen - ebenso etliche Gewerbeflächen, die zu Wohnraum umgebaut werden könnten. Sie zu nutzen wäre aus Sicht von Petzold deutlich nachhaltiger, als neu zu bauen.
Wenn es nach ihm ginge, würde sich der ""Bau-Turbo"" nur darauf beschränken, bestehende Gebäude umzufunktionieren. Er spricht von einem gigantischen Potential in Innenstadtbereichen. ""Ich glaube, jedem fallen zig Supermärkte ein, die eingeschossig sind, wo mehrere Etagen draufgesetzt werden könnten. Das würde auch dem demografischen Wandel begegnen können, weil einfach Wege verkürzt werden zu Versorgungseinrichtungen.""
Petzold spricht von einer ""Stadt der kurzen Wege"": ""Das wäre ein Konzept, das viel zukunftsfähiger ist - auch mit Blick auf die alternde Gesellschaft.""
Aufstocken und neu bauen - beides sieht der Gesetzentwurf vor. Nun wird es darum gehen, eine gesunde Balance zu finden. So oder so: Die Baubranche freut sich. Sie kann durch den ""Bau-Turbo"" mit etlichen neuen Aufträgen rechnen.",https://www.tagesschau.de/inland/innenpolitik/bauturbo-wohnungen-bundestag-100.html,"Kritik am geplanten „Bau-Turbo“: Weniger Bürgerbeteiligung und Umweltschutzbedenken
Die Bundesregierung plant einen „Bau-Turbo“, um bezahlbaren Wohnraum schneller zu schaffen. Dabei sollen Bauprojekte künftig innerhalb von zwei Monaten statt bisher bis zu fünf Jahren genehmigt werden. Kritik kommt von Katalin Gennburg (Linke), die eine Einschränkung demokratischer Mitbestimmung befürchtet. Sie warnt, dass Anwohner weniger Zeit für Einspruchsmöglichkeiten hätten, wenn Gemeinden auf Bebauungspläne verzichten. Auch die Grünen teilen diese Bedenken.
Bundesbauministerin Verena Hubertz (SPD) betont, dass Bürgerbeteiligung weiterhin möglich bleibe, jedoch ohne Verzögerungen. Umweltverbände wie der NABU kritisieren, dass der Fokus auf Neubau Grünflächen gefährde. Stefan Petzold (NABU) verweist auf leerstehende Wohnungen und Gewerbeflächen, die nachhaltiger genutzt werden könnten. Er plädiert für Aufstockungen bestehender Gebäude, um eine „Stadt der kurzen Wege“ zu fördern.
Während die Baubranche von mehr Aufträgen profitiert, bleibt die Debatte um Balance zwischen Tempo, Demokratie und Nachhaltigkeit offen.","【政治】
德国拟推“建筑加速计划”引争议：公众参与弱化与环保隐忧并存
德国联邦政府计划推出""建筑加速计划""，旨在缩短保障房审批流程（从最长5年压缩至2个月内），以加快经济适用房建设。左翼党议员卡塔琳·根堡批评该政策削弱民主决策，担忧社区放弃建设规划后居民申诉期将大幅缩短，绿党亦持相同立场。
联邦建设部长胡贝茨（社民党）强调公众参与机制仍将保留，但需避免程序延误。 环保组织NABU指出，过度聚焦新建项目将威胁绿地保护。其代表斯特凡·佩措尔德建议优先改造空置住宅及商业空间，提倡通过建筑加层实现""短途城市""规划。
建筑行业虽有望获得更多订单，但关于建设效率、民主参与与生态可持续性之间的平衡的讨论仍在持续。"
tagesschau,Bundesrat stimmt Investitionsbooster zu,2025-07-11T13:13:44.259Z,"Der Bundesrat hat den Weg für den ""Investitionsbooster"" freigemacht - ein Paket mit milliardenschweren Steuerentlastungen für Unternehmen. Kanzler Merz sagte, es sei dringend nötig, um wieder für Wachstum zu sorgen.
Nach dem Bundestag hat auch der Bundesrat dem Gesetz zum ""Investitionsbooster"" für Unternehmen einstimmig zugestimmt. Vorgesehen ist in mehreren Stufen eine deutliche steuerliche Entlastung, um Anreize für mehr Investitionen zu geben. So sollen Abschreibungsmöglichkeiten für die Jahre 2025 bis 2027 deutlich ausgeweitet und danach die Körperschaftsteuer schrittweise gesenkt werden.
Abschreibungen für neue Maschinen, Geräte und Fahrzeuge sollen damit schneller möglich sein. Die Körperschaftsteuer von derzeit 15 Prozent soll ab 2028 jährlich um einen Prozentpunkt sinken. Die Gesamtsteuerbelastung für Unternehmen soll damit ab 2032 knapp 25 Prozent statt aktuell knapp 30 Prozent betragen. Zudem wird die Steuerförderung für die Anschaffung von Elektro-Dienstwagen und die Forschungszulage ausgeweitet. Die gesamten Steuerausfälle für Bund, Länder und Kommunen werden bis 2029 auf mehr als 48 Milliarden Euro beziffert.
Von Seiten der Länder waren gegen das Gesetz mit Blick auf drohende Steuerausfälle zunächst massive Einwände geäußert worden. Vor rund zwei Wochen hatten sich beide Seiten jedoch darauf verständigt, dass der Bund die Mindereinnahmen für Kommunen in den Jahren 2025 bis 2029 vollständig ausgleicht.
Auch die Länder sollen einen Ausgleich in Form zusätzlicher Mittel für Infrastruktur-Investitionen in Kitas und Hochschulen erhalten. Zudem erhöht der Bund seinen Anteil am Transformationsfonds für Krankenhäuser. Diese Verständigung lobten in der Bundesratssitzung sowohl Bundeskanzler Friedrich Merz als auch mehrere Ministerpräsidentinnen und Ministerpräsidenten der Länder.
Merz sagte in seiner Antrittsrede im Bundesrat, es sei dringend nötig, wieder für Wachstum zu sorgen. Davon profitierten finanziell alle staatliche Ebenen. ""Wir müssen Deutschland für private Investitionen möglichst schnell wieder attraktiver machen"", so der CDU-Politiker. Bayerns Regierungschef Markus Söder (CSU) sprach vom Start einer Aufholjagd. Der Ministerpräsident Baden-Württembergs, Winfried Kretschmann (Grüne), sagte, das Investitionsprogramm komme zur richtigen Zeit, um Unternehmen zu entlasten. ""Deutschland braucht wieder Wachstum, und das so schnell wie möglich"", sagte NRW-Ministerpräsident Hendrik Wüst (CDU).
Merz bot den Ländern und Kommunen zudem eine enge und vertrauensvolle Zusammenarbeit an. ""Denn wir tragen die Verantwortung für eine gute Zukunft in Deutschland und Europa gemeinsam"", sagte er. Nur zusammen werde es gelingen, ""die staatlichen Entscheidungsstrukturen zu verschlanken, die digitale Infrastruktur weiterzuentwickeln, (...) und die Planungs- und Genehmigungsverfahren zu beschleunigen"", sagte Merz. Das gelte auch für den Bürokratierückbau.
Der Kanzler betonte, wegen der massiven Investitionen in Sicherheit und Infrastruktur in den kommenden Jahren werde der Bund an vielen Stellen Kosten senken müssen. ""Und auch in den Ländern und Kommunen brauchen wir eine ehrliche Aufgaben- und Ausgabenkritik. Lassen Sie uns diese große Aufgabe bitte gemeinsam angehen.""
Bundesratspräsidentin Anke Rehlinger erwiderte, die Länderkammer trage laut Grundgesetz eine große Verantwortung. ""Wir sind bereit, dieser Verantwortung gerecht zu werden."" Die Länder freuten sich auf ""eine gemeinsame, gute Zusammenarbeit zum Wohl unseres Landes"", sagte die saarländische Regierungschefin von der SPD.
Baden-Württembergs Ministerpräsident Kretschmann kritisierte allerdings, dass die neue Bundesregierung mit zahlreichen Bitten zur Fristverkürzung bei Gesetzesberatungen nahtlos an die vorherige Ampel-Regierung anknüpfe. Er mahnte eine Rückkehr zu regulären Beratungsverfahren mit den im Grundgesetz vorgesehenen Fristen an. ""Sonst steigt einfach die Gefahr von Fehlern.""
Der Bundesrat billigte darüber hinaus einenGesetzentwurf der schwarz-roten Koalitionfür eine Aussetzung des Familiennachzugs zu Geflüchteten mit sogenanntem subsidiären Schutz. Ein Vorschlag des Sozialausschusses, hierzu den Vermittlungsausschuss von Bundestag und Bundesrat anzurufen, fand keine Mehrheit.
Der Gesetzentwurf sieht vor, dass Geflüchtete mit eingeschränktem Schutzstatus, zu denen viele Menschen aus Syrien gehören, für zwei Jahre ihre Kernfamilie nicht mehr zu sich holen können. Das war bisher möglich für minderjährige Kinder und Ehepartner. Im Fall unbegleiteter Minderjähriger können aktuell auch Eltern ein Visum für die Familienzusammenführung in Deutschland erhalten.
Hier geht es bislang um 12.000 Menschen pro Jahr. Denn schon seit Jahren gilt für die Angehörigen von Menschen mit subsidiärem Schutz ein Kontingent von 1.000 Visa pro Monat. Der Gesetzentwurf sieht vor, dass Visa für Kinder, Ehepartner und Eltern von Menschen aus dieser Gruppe nur noch in seltenen Härtefällen ausgestellt werden sollen.
Und auch die von Schwarz-Rot im gemeinsamen Koalitionsvertrag vereinbarte Verlängerung der Mietpreisbremse fand in der Länderkammer die notwendige Mehrheit. Damit gilt die Regelung, die sonst Ende dieses Jahres ausgelaufen wäre, nun bis Ende 2029.
Die Mietpreisbremse kommt vor allem in Regionen mit als angespannt geltendem Wohnungsmarkt zum Tragen. Sie legt fest, dass die Miete bei Neuvermietung einer Wohnung zu Beginn höchstens um zehn Prozent über der ortsüblichen Vergleichsmiete liegen darf. Ausnahmen gelten für neu gebaute Wohnungen, die nach Oktober 2014 erstmals vermietet wurden, und Wohnungen, die nach einer umfassenden Modernisierung zum ersten Mal wieder vermietet werden.
Verstößt ein Vermieter gegen die Mietpreisbremse, kann die Mieterin oder der Mieter die überhöhte Miete zurückverlangen. Die Bundesregierung plant aber, weitere Regelungen im Mietrecht zu verschärfen. Nach der Sommerpause werde eine dafür zuständige Expertenkommission ihre Arbeit aufnehmen, kündigte Bundesjustizministerin Stefanie Hubig an. Ein Vorschlag, der dabei im Raum steht: Bei Verstößen gegen die Mietpreisbremse könnte Vermietern künftig nicht nur die Erstattung von Mietzahlungen drohen, sondern zusätzlich auch ein Bußgeld.",https://www.tagesschau.de/inland/wachstumspaket-bundesrat-merz-100.html,"Bundesrat billigt „Investitionsbooster“ mit milliardenschweren Steuerentlastungen
Der Bundesrat hat einstimmig das Gesetz zum „Investitionsbooster“ verabschiedet, das Unternehmen durch steuerliche Entlastungen im Umfang von über 48 Milliarden Euro bis 2029 entlasten soll. Kernmaßnahmen sind ausgeweitete Abschreibungsmöglichkeiten für Investitionen in Maschinen und Fahrzeuge (2025–2027) sowie eine schrittweise Senkung der Körperschaftsteuer von 15 Prozent ab 2028 (jährlich um 1 Prozentpunkt). Ziel ist es, die Gesamtsteuerbelastung für Unternehmen bis 2032 von derzeit rund 30 auf etwa 25 Prozent zu senken. Zusätzlich werden Förderungen für Elektro-Dienstwagen und Forschungszulagen ausgeweitet.
Trotz anfänglicher Bedenken der Länder wegen steuerlicher Mindereinnahmen einigten sich Bund und Länder auf Kompensationszahlungen: Der Bund gleicht kommunale Ausfälle (2025–2029) vollständig aus und unterstützt Länder mit Mitteln für Infrastrukturprojekte (Kitas, Hochschulen) sowie durch höhere Zuschüsse zum Krankenhaus-Transformationsfonds. Bundeskanzler Friedrich Merz (CDU) betonte die Dringlichkeit des Pakets für wirtschaftliches Wachstum und Investitionsattraktivität. Länderchefs wie Markus Söder (CSU) und Winfried Kretschmann (Grüne) begrüßten die Maßnahmen, kritisierten jedoch überhastete Gesetzesverfahren.
Weitere Beschlüsse:
Familiennachzug: Der Bundesrat billigte ein Gesetz zur zweijährigen Aussetzung des Familiennachzugs für Geflüchtete mit subsidiärem Schutz (u.a. Syrer). Kernfamilien erhalten nur noch in Härtefällen Visa (bisher 1.000 pro Monat).
Mietpreisbremse: Die Regelung wurde bis 2029 verlängert. Sie begrenzt Neuvermietungen auf maximal 10 Prozent über der ortsüblichen Miete, mit Ausnahmen für Neubauten und modernisierte Wohnungen. Bei Verstößen drohen künftig möglicherweise Bußgelder.
Die Beschlüsse markieren zentrale wirtschafts- und sozialpolitische Weichenstellungen der schwarz-roten Koalition.","【经济】
德国联邦议院批准“投资激励计划”，提供数十亿欧元税收减免
德国联邦议院一致通过“投资激励”法案，拟在2029年前为企业提供超过480亿欧元的税收减免。核心措施包括：扩大对新购机器、设备和车辆的折旧抵扣范围（2025-2027年），以及从2028年起逐步将企业所得税从15%每年降低1个百分点。目标是到2032年将企业总税负从目前的约30%降至25%。此外，电动车公务车补贴也将扩大、研发费用抵扣政策将得到增强。
尽管各州最初因税收减少表示担忧，但联邦与州政府最终达成补偿协议：联邦将全额弥补地方财政缺口（2025-2029年），各州还将获得额外资金，用于改善幼儿园与高校等基础设施建设。同时，联邦政府也将提高其在医院转型基金中的出资比例。德国总理默茨强调该计划对经济增长和投资吸引力的紧迫性。各州长总体支持这一措施，但也批评立法程序过于仓促。
联邦议院通过的其他决议还包括：1）家庭团聚：暂停对获得辅助性保护难民（如叙利亚人）的家庭团聚签证两年，仅核心家庭成员在极为特殊的困难情况下可获签。 2）房租刹车：租金限制令适用于房屋紧张的地区。该令规定，新租约价格不得超过当地基准租金的10%，2014年10月后首次出租的新建住房或经过全面翻修后首次出租的房产除外。将来，违规者还可能面临罚款。这些决议都标志着黑红联盟在经济和社会政策方面的关键转向。"
