source,title,datepub,article,link,summary,zh_summary
tagesschau,"Arbeitsministerin Bas zur Rente: ""Wir opfern die Generationengerechtigkeit nicht""",2025-08-06T15:49:56.961Z,"Bundesarbeitsministerin Bas hat in dentagesthemendas vom Kabinett beschlossene Rentenpaket verteidigt. Man müsse baldigen Rentnern Stabilität geben. Das System müsse aber auch den Jüngeren gerecht werden.
Mit der vom Kabinettbeschlossenen Stabilisierung des Rentenniveausbis 2031 werde die Generationengerechtigkeit nicht geopfert, sagte Arbeitsministerin Bärbel Bas im Interview mit dentagesthemen. Es sei wichtig, baldigen Rentnerinnen und Rentnern mit auf den Weg zu geben, dass ihre Rente zumindest bis 2031 stabil bei 48 Prozent bleibe. Schließlich hätten diese Menschen in das System eingezahlt.
Bas wies darauf hin, dass viele Menschen in Deutschland keine weitere Absicherung als die gesetzliche Rente haben. In Ostdeutschland seien das 75 Prozent, in Westdeutschland 52 Prozent. Diesen Menschen könne man nicht sagen: ""Wir reduzieren jetzt weiter das Rentenniveau."" Außerdem hätten auch jüngere Menschen ""etwas davon, wenn ihre Elternnicht in der Altersarmut landen"".
Den Jüngeren würden künftig noch weitere geplante Bausteine zugutekommen wie die Frühstartrente und die Betriebsrente. Auch die Aktivrente sei ein Baustein. ""Die, die länger arbeiten möchten, können das tun, und wir machen das attraktiver"", so Bas.
Gefragt, wie sich das deutsche Rentensystem in Zukunft finanzieren soll - und zwar auch nachhaltig für die nächsten Generationen ab 2031, verwies Bas auf die Rentenkommission, die 2026 eingesetzt und ab 2027 Vorschläge zu dieser Frage vorlegen soll.
Die Kommission habe die Aufgabe, denen gerecht zu werden, die jetzt in Rente gingen, aber auch der jüngeren Generation. Die Menschen, die jetzt in Ausbildung oder Arbeit gingen, müssten, wenn sie in das System einzahlten, die Sicherheit haben, eine Rente zu bekommen, die ihren Lebensstandard sichere. Das zu erarbeiten, sei Aufgabe der Kommission.
Bas verteidigte das jetzt beschlossene Rentenpaket. ""Damit machen wir die ersten Schritte."" Dennoch müsse sich die Politik natürlich damit befassen, wie das System langfristig zu finanzieren ist.",https://www.tagesschau.de/inland/innenpolitik/bas-tagesthemen-rentenpaket-100.html,"Zusammenfassung des Rentenpakets: Bas betont Generationengerechtigkeit  
Bundesarbeitsministerin Bärbel Bas (SPD) verteidigte in einem Interview das vom Kabinett beschlossene Rentenpaket. Ziel sei es, sowohl baldigen Rentnern Planungssicherheit zu bieten als auch jüngere Generationen fair zu behandeln. Das Rentenniveau soll bis 2031 stabil bei 48 Prozent gehalten werden, um Altersarmut zu verhindern. Bas betonte, dass viele Deutsche – 75% im Osten und 52% im Westen – ausschließlich auf die gesetzliche Rente angewiesen seien. 
Für Jüngere sind weitere Maßnahmen geplant, darunter die Frühstartrente, Betriebsrente und die „Aktivrente“, die längeres Arbeiten attraktiver machen soll. Langfristige Finanzierungsfragen ab 2031 sollen durch eine 2026 einzusetzende Rentenkommission geklärt werden, die ab 2027 Vorschläge vorlegen wird. Bas betonte, die Kommission müsse sowohl aktuelle Rentner als auch Beitragszahler von heute berücksichtigen, um nachhaltige Lösungen zu entwickeln. Das aktuelle Paket sei ein erster Schritt, doch die langfristige Finanzierung bleibe eine politische Aufgabe.","【政治】  

养老金改革方案出炉：德国劳工部长强调代际公平  
德国联邦劳工部长巴贝尔·巴斯（社民党）在采访中为内阁通过的养老金改革方案辩护。该方案旨在为即将退休者提供保障，同时兼顾年轻一代的公平性。养老金水平将维持48%至2031年，以防止老年贫困。巴斯指出，目前75%的东部居民和52%的西部居民完全依赖法定养老金。  
针对年轻群体，政府计划推出“早启养老金”、企业年金及鼓励延迟退休的“活力养老金”。2031年后的长期资金问题将由2026年成立的养老金委员会研究，并于2027年提交方案。巴斯强调，委员会须平衡当前退休者与缴费者的利益，制定可持续方案。巴斯强调，目前方案是朝着代际公平迈出的第一步，未来养老金体系的可持续融资仍是政治必须承担的重要任务。"
tagesschau,Gesetz gegen Schwarzarbeit: Eine Baustelle für Klingbeil und Bas,2025-08-06T13:57:22.254Z,"Durch Schwarzarbeit entgehen dem Bund jedes Jahr hohe Einnahmen. Jetzt sollen Kontrollen verschärft werden. Finanzminister Klingbeil und Arbeitsministerin Bas machen sich vor Ort ein Bild von der Arbeit des Zolls.
Sie kommen mit Blaulicht und fast zwei Dutzend weiß-blauen Autos: 100 Kontrolleure mit stichsicheren Westen, dazu grellgelbe Überzieher mit der großen Aufschrift ""Zoll"". Die Einsatzkräfte der Finanzkontrolle Schwarzarbeit laufen schnellen Schrittes auf eine Baustelle in Berlin. Eine verdachtsunabhängige Prüfung, wie es heißt. Überraschend also.
Etwas hinterher hängt eine Traube Journalisten samt Kamerateams und zwei Menschen, die sich die Warnwesten über ihre weißen Hemden gezogen haben. Diese beiden sind keine Profis vom Zoll, sondern die SPD-Bundesminister Lars Klingbeil und Bärbel Bas.
Sie wollen sich angucken, wie so eine Baustellenkontrolle praktisch abläuft. ""Für uns geht es darum, dass die wenigen, die sich auf Kosten der Allgemeinheit bereichern, dingfest gemacht werden"", sagt Finanzminister Klingbeil später.
Erst einmal aber bekommen er und Arbeitsministerin Bas von Einsatzleiter Ronny Tillmann erklärt, worauf es heute ankommt. Geprüft wird beispielsweise, ob alle auf der Baustelle Sozialbeiträge zahlen, ob womöglich jemand arbeitslos gemeldet ist und trotzdem arbeitet, ob jemand illegal beschäftigt wird oder nicht den Mindestlohn bekommt. Der ist für Elektriker, Dachdecker und Gerüstbauer unterschiedlich. Arbeitsministerin Bas nickt.
Schwarzarbeit ist ein Problem, das den Staat viel Geld kostet. Bei 766 Millionen Euro lag die Schadenssumme, die der Zoll im vergangenen Jahr in Deutschland festgestellt hat - 369 Millionen davon allein im Baugewerbe. Weit geringer sind die verhängten Strafgelder: Hier kamen 30 Millionen zusammen.
Das ist wohl nur die Spitze des Eisbergs. Beim Institut der deutschen Wirtschaft forscht Dominik Enste zur Schwarzarbeit, seit zwanzig Jahren beschäftigt ihn das Thema. Mit anonymen Befragungen, Hochrechnungen und Analysen versucht er, dem Dunkelfeld auf die Spur zu kommen. Er geht davon aus, dass mehr als 3,3 Millionen Menschen in Deutschland schwarzarbeiten.
Das koste die Unternehmen hierzulande bis zu 500 Milliarden Umsatz pro Jahr, sagt Enste. Dem Fiskus und den Sozialversicherungen entgehen ihm zufolge jährlich etwa 16 Milliarden. Gewaltige Summen. Allerdings: Schwarzarbeit komplett auf Null zu reduzieren, sei kaum möglich, sagt der Experte. ""Ein Land ganz ohne Schattenwirtschaft und Schwarzarbeit gibt es nicht"", so der Forscher.
Das ist auch dem Bundesfinanzminister klar. Doch der Weg ist das Ziel. Zwei Milliarden Mehreinnahmen ab 2028 sollen es laut dem Gesetzentwurf werden. Signale senden, Schwarzarbeit eindämmen - soweit es eben geht.
Bei der Baustellenkontrolle in Berlin ist Einsatzleiter Tillmann mit dem Briefing der Politiker fertig. ""So"", sagt Klingbeil, ""Theorieteil abgeschlossen."" Dann gehen die Ministerin und der Minister auf die Baustelle.
Auf so einer Baustelle wollten sich in der Regel viele Arbeiter gar nicht der Prüfung entziehen, sagt Einsatzleiter Tillmann. ""Wir sind ja auch für die Arbeitnehmer da"", so der Mann vom Zoll. ""Wir wollen ja, dass die ihren Lohn bekommen, auf den sie einen Anspruch haben, dass sie nicht ausgebeutet werden."" Auf der heutigen Baustelle habe es aber vorab keine Hinweise darauf gegeben. Es sei eine Zufallsprüfung.
Der Bau hat den größten Anteil an der Statistik, steht aber bereits länger im Katalog der von Schwarzarbeit besonders betroffenen Branchen. Die Liste soll durch das geplante Gesetz erweitert werden: Beispielsweise Barbershops, Kosmetik- und Nagelstudios kommen neu hinzu. In diesen Branchen wird intensiver kontrolliert. Generell sollen Arbeitnehmer in diesen Branchen nun verpflichtet werden, bei der Arbeit den Personalausweis dabei zu haben und sich bei Kontrollen auszuweisen.
Die Kontrolleure vom Zoll sollen auch mehr Befugnisse bekommen. Die Datenanalyse und der Datenaustausch sollen verbessert werden. Für zusätzliches Personal und das Upgrade bei der Technik will das Finanzministerium in den kommenden vier Jahren fast 500 Millionen Euro ausgeben.
Das trifft bei der Zollgewerkschaft einen Nerv. ""Viele Prozesse laufen noch papiergebunden"", schreibt die in ihrer Stellungnahme: ""Wie so oft betont nützen auch die besten neuen Befugnisse wenig, wenn die technische Realität vor Ort veraltet bleibt."" Das soll sich ändern, die digitale Vernetzung soll besser werden.
Tatsächlich sieht man auf der Baustelle in Berlin noch Kontrolleure, die Klemmbretter mit einem Papierstapel in der Hand halten. Die Prüfung läuft weiter, als die Ministerin und der Minister das Gebäude nach einer guten Viertelstunde wieder verlassen. Ergebnisse werden wohl erst in einigen Tagen feststehen, teils müssen im Nachhinein Daten überprüft werden.
Durch das Gesetz sollen die Daten aus den Prüfungen in Zukunft auch an die Jobcenter gemeldet werden. ""Sozialleistungsbetrug wie auch Schwarzarbeit, das ist kein Kavaliersdelikt"", sagt Arbeitsministerin Bas vor der Baustelle den Journalisten. Der Datenaustausch mit den Jobcentern sei deswegen ein wichtiger Aspekt: ""Damit wir die Möglichkeit haben, zu Unrecht gezahlte Sozialleistungen auch schnell zurückzufordern.""
Ein Schritt voran. Dennoch werde das Gesetz die Schwarzarbeit nicht abschaffen, ist das Fazit von Schwarzarbeitsforscher Enste. ""Der private Handwerker, den sie nur zum Teil offiziell abrechnen, ist für den Zoll kaum zugänglich"", erklärt er.""Auch Haushaltshilfen sind zu 90 Prozent nicht angemeldet. Aber der Zoll kann ja nicht quasi in die Privatwohnung eindringen, um die illegal beschäftigte Haushaltshilfe festzunehmen.""
Insgesamt stehe Deutschland allerdings gut da. Es gebe eine vergleichsweise gute Steuermoral, die helfe gegen Schwarzarbeit: ""Man muss vermeiden, dass man italienische Verhältnisse bekommt, wo der Bürger den Staat quasi als Feind, als Gegner ansieht, dem man ein Schnippchen schlagen möchte.""
Vor der Berliner Baustelle lassen sich Klingbeil und Bas inzwischen Tricks bei der Schwarzarbeit erklären. Besonders polnische Dokumente würden oft gefälscht, erklärt ein Zollbeamter. Das Ziel: sich als EU-Bürger mit Arbeitsrecht auszugeben.
Wie gut die Fälschungen denn so seien, fragt Klingbeil. ""Das geht von bis"", antwortet der Beamte. ""Es gibt sehr gute Fälschungen, aber auch solche für ein paar Hundert Euro, die wirklich schlecht sind.""
Nachdem das Kabinett heute den Entwurf für das Schwarzarbeitsbekämpfungsgesetz durchgewunken hat, geht dieser nun in den parlamentarischen Prozess. Bis der Bundestag das Gesetz beschließt, kann es noch einige Monate dauern.",https://www.tagesschau.de/inland/innenpolitik/schwarzarbeit-kabinett-baustelle-100.html,"Bundesregierung verschärft Kontrollen gegen Schwarzarbeit – Milliardenverluste für den Staat  
Bundesfinanzminister Lars Klingbeil (SPD) und Bundesarbeitsministerin Bärbel Bas (SPD) besuchten eine Zollkontrolle auf einer Berliner Baustelle, um sich über die Bekämpfung von Schwarzarbeit zu informieren. Die verdachtsunabhängige Prüfung durch 100 Zollbeamte sollte exemplarisch zeigen, wie illegale Beschäftigung, Sozialleistungsbetrug und Mindestlohnverstöße aufgedeckt werden.  
Laut Zoll entgingen dem Staat 2024 durch Schwarzarbeit 766 Millionen Euro, davon 369 Millionen im Baugewerbe. Experte Dominik Enste vom Institut der deutschen Wirtschaft schätzt jedoch, dass die Dunkelziffer weit höher liegt: Rund 3,3 Millionen Menschen arbeiten schwarz, was jährlich etwa 16 Milliarden Euro an Steuern und Sozialabgaben kostet.  
Ein neues Gesetz soll ab 2028 jährlich zwei Milliarden Euro Mehreinnahmen bringen. Geplant sind schärfere Kontrollen in Branchen wie Bau, Nagelstudios und Friseursalons, verpflichtende Personalausweise für Arbeitnehmer sowie verbesserte Datenanalysen. Das Finanzministerium investiert 500 Millionen Euro in Technik und Personal. Kritik kommt von der Zollgewerkschaft, die auf veraltete Prozesse hinweist.  
Trotz der Maßnahmen bleibt Schwarzarbeit laut Enste ein Problem, besonders im privaten Bereich. Das Kabinett hat den Gesetzentwurf bereits beschlossen; die parlamentarische Beratung beginnt nun.","【经济】  
每年税收流失过百亿，德国加强打击黑工
德国财政部长克林拜尔（社民党）与劳工部长巴斯（社民党）突击检查柏林某建筑工地，启动针对黑工的专项整治行动。约100名海关人员开展无差别核查，重点打击非法用工、骗领社保及违反最低工资标准行为。  
官方数据显示，2024年黑工导致国家税收损失7.66亿欧元，其中建筑业占比48%。但科隆经济研究所专家恩斯特指出，实际规模更为严峻：约330万人以黑工形式就业，造成年税收及社保流失高达160亿欧元。  
新法案拟自2028年起年增收20亿欧元，措施包括强化建筑、美甲、美发等重点行业检查，推行强制工牌制度及升级数据分析系统。德国财政部将投入5亿欧元升级执法设备并扩编人员，但海关工会批评当前检查流程效率低下，呼吁加快系统升级，以确保新措施落地有效。  
专家表示，家庭领域如家政服务与非正式手工服务依旧难以监管，黑工现象难以彻底根除。该法案已获内阁通过，即将进入议会审议程序。"
t-online,Die Gaspreis-Senkung ist eine Frechheit,2025-08-06T12:16:00.000Z,"Die subjektive Sicht des Autors auf das Thema. Niemand muss diese Meinung übernehmen, aber sie kann zum Nachdenken anregen.
Dass die Bundesregierung die Gaspreise senkt, die Strompreise für Haushalte aber nicht, ist ein Fehler. Damit lässt sie an ihrer Strategie zweifeln – und sendet ein falsches Signal.
DieBundesregierungist unter anderem mit diesem Versprechen an den Start gegangen: DieEnergiepreise müssen für allesinken. Besonders beim Strom war man sich einig, schließlich hat Deutschland im Vergleich zu den europäischen Nachbarn die höchsten Strompreise. Dass jetzt entschieden wurde, zum Jahreswechsel dieGaspreisspeicherumlage abzuschaffen, die Strompreise für Haushalte aber (größtenteils) unangetastet zu lassen, ist daher eine Frechheit.
Und es ist einfach nicht gerecht, denn: Nicht jeder in Deutschland bezieht Gas und kommt in den Genuss der Entlastung. Genau genommen profitiert nur etwas mehr als die Hälfte der Bevölkerung, die andere Hälfte wird im Stich gelassen.
Denn jeder Einzelne im Land nutzt Strom. Mit der ursprünglich versprochenenAbsenkung der Stromsteuer auf das europäische Mindestmaßhätte man also auf einen Schlag alle Menschen entlastet. Und vor allem hätte es diejenigen entlastet, die viel Strom verbrauchen, zum Beispiel, weil sie einElektroautofahren oder eine Wärmepumpe besitzen. Das waren doch mal diejenigen, die man fördern wollte, oder?
Eigentlich ist das auch das Ziel der Bundesregierung. DerKoalitionsvertragbekennt sich ganz klar zu den Klimazielen – und diese sind nur zu erreichen, wenn wir im Privathaushalt endlich von Gas weg- und zu Heizformen hinkommen, die Strom aus Erneuerbaren nutzen können. Friedrich Merz hatte selbst im Frühjahr in einem Interview gesagt: ""Die Menschen müssen irgendwann erkennen, dass es sich nicht mehr lohnt, die alte Öl- oder Gasheizung zu betreiben.""
Im Kontext der Entscheidung, die Gaspreise nun zu senken, muss man sich fragen, ob Merz das wirklich ernst meint. Die Bundesregierung argumentiert damit, dass der Staat knapp bei Kasse sei und es erst mal wichtiger sei, die Wirtschaft zu entlasten und Jobs zu sichern. Und es stimmt: Gas spielt in der Wirtschaft eine wichtige Rolle und wird das auch in der näheren Zukunft weiterhin tun. Dann hätte die Regierung die Gasspeicherumlage aber auch nur für Unternehmen abschaffen können – auch das wäre zwar ein Ärgernis für Privathaushalte gewesen, aber es hätte wenigstens zur Argumentation gepasst.
Außerdem bezieht auch die Wirtschaft Strom – und große Teile des Mittelstands gehen durch diese Entscheidung genauso leer aus wie private Haushalte. Die Argumentation der Regierung wankt also spätestens an diesem Punkt. Diejenigen, die schon in umweltfreundliche und strombasierte Technologien investiert haben, werden für diese Entscheidung jetzt abgestraft.
Am Ende kommt es aber auf die Botschaft an, die überall im Land ankommen soll. Stand jetzt ist die Ansage klar und deutlich: Gas wird günstiger, Strom aber bleibt teuer.",https://www.t-online.de/finanzen/aktuelles/id_100855618/gaspreise-sinken-warum-das-ungerecht-ist.html,"Bundesregierung senkt Gaspreise – Strompreise für Haushalte bleiben hoch
Die Bundesregierung hat beschlossen, die Gaspreisspeicherumlage abzuschaffen, wodurch die Gaspreise sinken. Allerdings bleiben die Strompreise für Privathaushalte weitgehend unverändert, was auf Kritik stößt. Ursprünglich hatte die Koalition versprochen, die Energiepreise insgesamt zu senken, insbesondere die hohen Stromkosten in Deutschland.  
Kritiker bemängeln, dass nur etwa die Hälfte der Bevölkerung von der Gaspreissenkung profitiert, während alle Haushalte Strom nutzen. Eine Senkung der Stromsteuer auf europäisches Mindestniveau hätte breitere Entlastung gebracht, vor allem für Haushalte mit hohem Stromverbrauch, wie Besitzer von Elektroautos oder Wärmepumpen. Dies widerspricht laut Kritikern den Klimazielen der Regierung, die einen Umstieg von fossilen Brennstoffen auf erneuerbare Energien fördern will.  
Die Bundesregierung begründet ihre Entscheidung mit knappen Staatsfinanzen und der Notwendigkeit, die Wirtschaft zu entlasten. Doch auch viele mittelständische Unternehmen, die stark auf Strom angewiesen sind, gehen leer aus. Die Maßnahme wirft Fragen zur Kohärenz der Energiepolitik auf und sendet nach Ansicht von Kritikern das falsche Signal: Gas wird billiger, während Strom teuer bleibt – trotz der angestrebten Energiewende.  ","【经济】  

德国政府降低天然气价格，居民电价仍居高不下 
德国联邦政府曾决定取消天然气价格储备附加费，降低天然气价格。然而，对于私人家庭而言，电价基本维持不变，这一决定引发了批评。联合政府原本承诺要整体降低能源价格，尤其是德国居高不下的电价。
批评人士指出，只有大约一半人口会从天然气降价中受益，而所有家庭都使用电力。如果将电力税降低至欧盟规定的最低水平，将能带来更广泛的减负效果，尤其是对电动汽车和热泵等高耗电家庭而言。批评人士认为，这一做法有悖于政府的气候目标——即鼓励从化石燃料向可再生能源转型。
联邦政府则以财政紧张和需要减轻企业负担为由，为其决定进行辩护。然而，许多对电力依赖度高的中小企业并未从中受益。这一政策引发了人们对政府能源政策一致性的质疑。批评者认为，这传递出了错误的信号：天然气变便宜了，而电力依然昂贵——尽管政府正推进能源转型。"
t-online,"""An den Realitäten in der Pflege vorbei""",2025-08-06T08:27:00.000Z,"Im Bundeskabinett geht es am Mittwoch um zwei Gesetze zum Thema Pflege. Die Branche zeigt sich aber unzufrieden mit den Details.
Eigentlich wollte bereits die Ampelregierung ein neues Pflegekompetenzgesetz verabschieden. Der entsprechende Entwurf des Gesundheitsministeriums war bereits ausgearbeitet und vom Kabinett beschlossen. Doch weil die Regierung kurz darauf zerbrach, wurde das Gesetz nie vom Bundestag verabschiedet. Nun nimmt die schwarz-rote Regierung einen neuen Anlauf. Doch die Pflegebranche zeigt sich unzufrieden.
Das Gesetz des Gesundheitsministeriums von Nina Warken (CDU) wird am Mittwoch in der Kabinettssitzung behandelt. Ziel ist es, dass das Pflegepersonal künftig mehr Tätigkeiten übernehmen darf. Gelten soll das etwa für chronische und stabile Erkrankungen wie Diabetes oder Bluthochdruck. In der Praxis soll dies allerdings vorerst nur vereinzelt umgesetzt werden. Denn zunächst sind Modellvorhaben geplant, die erst ausgewertet werden müssen, bevor dauerhaft Kompetenzen übertragen werden sollen.
Der Branche geht das nicht weit genug. Thomas Knieling, Bundesgeschäftsführer des Verbands Deutscher Alten- und Behindertenhilfe, kritisiert bei t-online, das Gesetz bleibe ""inhaltlich weit hinter den Erwartungen zurück und unterscheidet sich kaum vom Entwurf der vorherigen Bundesregierung"". Er fordert eine sofort wirksame Entlastung statt modellhafter Zwischenlösungen.
Die Kompetenzübertragung an Pflegefachkräfte wirkt laut Knieling ""mutlos und unentschlossen"", es seien ""minimale Korrekturen"". Er forderte mehr Verantwortung für die Pflegekräfte sowie eine Entlastung im Alltag, insbesondere durch eine eigenständige Verordnung von Hilfsmitteln. Eine solche Verordnungskompetenz fehlt in dem Entwurf ganz. Mögliche Kompetenzen werden nach Meinung Knielings durch ""Prüfvorbehalte Dritter und zusätzliche Qualifikationshürden"" konterkariert.
Allerdings sieht er nicht nur negative Aspekte. Er lobt den Ansatz, stambulante Versorgung (also stationär-ambulant überlappender Angebote) regelhaft zu ermöglichen, als ""richtiges Vorhaben"".
Außerdem geht es am Mittwoch im Kabinett um das sogenannte Pflegeassistenzgesetz, das die Ausbildung bundesweit vereinheitlichen soll, die bisher noch durch die Länder geregelt wird. Ein Punkt ist dabei eine angemessene Bezahlung, die bisher oft nicht gegeben war. Den Vorstoß begrüßt auch Knieling. So sei ""eine bundeseinheitliche Ausbildung zur Pflegeassistenz dringend erforderlich – der Bedarf an qualifizierten Kräften ist enorm"".
Ein wesentlicher Aspekt ist dabei auch die Festschreibung der Ausbildungsdauer auf 18 Monate. Das sieht der Pflegeverbandschef Knieling allerdings kritisch. Er präferiert eine einjährige Ausbildung, wie sie aktuell die Regel ist. Seine Einschätzung: ""Die notwendigen Kompetenzen lassen sich in diesem Zeitraum gut vermitteln, und die Einrichtungen dürfen nicht noch länger auf dringend benötigtes Personal warten."" Alles andere ""würde an den Realitäten in der Pflege vorbeigehen"".
Allerdings besteht noch die Möglichkeit für Anpassungen. Wenn das Kabinett die Entwürfe entsprechend verabschiedet, muss im weiteren Verlauf auch der Bundestag noch zustimmen.
Doch die beiden Gesetze sind nicht die einzigen Vorstöße im Bereich der Pflege.Vor einem Monat wurde eine Pflegekommission einberufen, die in den kommenden Monaten Vorschläge für eine grundsätzliche Reform des Pflegesystems erarbeiten soll.
Quellen anzeigen",https://www.t-online.de/nachrichten/deutschland/innenpolitik/id_100855362/pflegegesetze-im-kabinett-mehr-kompetenzen-aber-kritik-aus-der-branche.html,"Bundeskabinett berät über Pflegereformen – Branche kritisiert unzureichende Lösungen 
Am Mittwoch behandelt das Bundeskabinett zwei zentrale Pflegegesetze: das Pflege-kompetenzgesetz und das Pflegeassistenzgesetz. Gesundheitsministerin Nina Warken (CDU) will mit dem Pflegekompetenzgesetz Fachkräften mehr Handlungsspielraum geben, etwa bei der Behandlung chronischer Erkrankungen wie Diabetes. Allerdings sind zunächst nur Modellprojekte geplant, was die Branche als zu zögerlich kritisiert. Thomas Knieling, Bundesgeschäftsführer des Verbands Deutscher Alten- und Behindertenhilfe, bemängelt, der Entwurf unterscheide sich kaum vom Vorhaben der Vorgängerregierung und fehle entscheidende Punkte wie eine Verordnungskompetenz für Hilfsmittel. Positiv bewertet er hingegen die geplante Regelung zur stambulanten Versorgung.  
Das Pflegeassistenzgesetz zielt auf eine bundesweite Vereinheitlichung der Ausbildung ab, inklusive verbindlicher Bezahlung. Knieling begrüßt dies grundsätzlich, kritisiert aber die geplante Verlängerung der Ausbildungsdauer auf 18 Monate – eine einjährige Ausbildung sei praxisnäher. Beide Gesetze müssen nach Kabinettsbeschluss noch den Bundestag passieren. Parallel arbeitet eine neu eingesetzte Pflegekommission an einer Systemreform, die langfristige Lösungen für den Fachkräftemangel und strukturelle Probleme bringen soll.","【政治】  
德国内阁审议护理改革方案，行业批评力度不足
周三，德国联邦内阁审议了两项核心护理法案：《护理能力法》与《护理助理法》。
卫生部长瓦尔肯（基民盟）希望通过《护理能力法》为护理专业人员赋予更多自主权，例如在治疗糖尿病等慢性疾病时可以自行做出医疗决策。然而，法案初期仅限于试点项目，这一点遭到了护理行业的批评，被认为过于保守。德国老年与残疾人护理协会（VDAB）联邦常务董事托马斯·克尼林指出，该草案与前任政府的计划几乎无异，缺乏关键内容，例如对医疗辅助器具的处方权限。不过，他对拟议中的“门诊-住院混合照护模式”的规定持积极态度。
《护理助理法》旨在在全国范围内统一护理助理的培训体系，并引入统一的强制薪酬标准。克尼林对这一方向总体表示欢迎，但批评培训期限将被延长至18个月，认为一年制的培训更贴近实践、更高效。
这两项法案通过内阁审议后，仍需获得联邦议院批准。同时，政府还设立了一个新的“护理委员会”，致力于从制度层面推动改革，解决护理行业长期存在的人员短缺与结构性问题。"
