source,title,datepub,article,link,summary,zh_summary
t-online,"""Die deutsche Wirtschaft wird erheblichen Schaden nehmen""",2025-07-28T16:35:00.000Z,"Der Kanzler rechnet nach der Zolleinigung mit den USA mit schweren Folgen für Deutschland. Eine bessere Einigung sei nicht möglich gewesen, zufrieden sei er trotzdem nicht.
Die deutsche Wirtschaft wird nach Einschätzung von BundeskanzlerFriedrich Merz(CDU) erheblich unter den neuen US-Zöllen leiden. Nach einer Sitzung des Sicherheitskabinetts inBerlinerklärte Merz, der Kompromiss mit denUSAim Zollkonflikt werde die exportorientierte Wirtschaft Deutschlands hart treffen. ""Die deutsche Wirtschaft wird erheblichen Schaden nehmen durch diese Zölle"", sagte er laut Nachrichtenagentur dpa.
Hintergrund ist eine Einigung zwischen der EU und den USA,die unter anderem einen Zollsatz von 15 Prozent auf die meisten Importe vorsieht– darunter auch Autos, Halbleiter und Pharmaprodukte. Für einzelne Waren wie Aluminium und Stahl bleiben Zölle von 50 Prozent bestehen.
Merz betonte, dass die Auswirkungen über Deutschland hinausreichen dürften. ""Wir werden auch in Amerika die Folgen dieser Handelspolitik sehen."" Neben einer höherenInflationsei mit Beeinträchtigungen des transatlantischen Handels insgesamt zu rechnen. ""Diese Zölle sind auch nach meiner festen Überzeugung nicht im Interesse der Vereinigten Staaten von Amerika.""
Mit dem Verhandlungsergebnis zeigte sich Merz unzufrieden. ""Ich bin mit diesem Ergebnis nicht zufrieden im Sinne von 'das ist jetzt gut so'"", sagte er. Allerdings habe er auch nicht mehr erwartet. ""Mehr war offensichtlich nicht zu erreichen.""
Er dankte der EU-Kommission ausdrücklich für ihren Einsatz in den Gesprächen mit der US-Regierung. Die Verhandlungen hatten sich über Monate hingezogen. Ziel war es, die ab dem 1. August drohende Erhöhung derUS-Zölleauf 30 Prozent abzuwenden.
Nach US-Angaben sollen europäische Unternehmen im Gegenzug verstärkt in den USA investieren. Zudem will die EU künftig mehr US-Flüssigerdgas importieren. Viele Details der Vereinbarung, etwa die konkreten Zollniveaus auf EU-Seite, bleiben bislang offen.",https://www.t-online.de/finanzen/aktuelles/wirtschaft/id_100842076/zolleinigung-merz-warnt-vor-schweren-folgen-fuer-deutsche-wirtschaft.html,"Zolleinigung mit USA belastet deutsche Wirtschaft
Bundeskanzler Friedrich Merz (CDU) warnt vor erheblichen negativen Auswirkungen der neuen US-Zölle auf die deutsche Exportwirtschaft. Nach einer Sitzung des Sicherheitskabinetts in Berlin kritisierte Merz die Einigung zwischen der EU und den USA, der zufolge für zahlreiche Importgüter – darunter auch Autos, Halbleiter und Pharmaprodukte – künftig Zölle von bis zu 15 Prozent gelten sollen. Für bestimmte Produkte wie Stahl und Aluminium bleiben die bestehenden Zölle von 50 Prozent unverändert. Merz betonte, die Maßnahmen würden nicht nur Deutschland, sondern auch die USA durch Handelseinschränkungen und höhere Inflation treffen.
Obwohl Merz das Ergebnis als „nicht zufriedenstellend“ bezeichnete, räumte er ein, dass keine bessere Lösung erreichbar war. Die EU-Kommission habe sich in den monatelangen Verhandlungen bemüht, eine Erhöhung der US-Zölle auf 30 Prozent abzuwenden, die ab 1. August 2025 drohte. Im Gegenzug sollen europäische Unternehmen verstärkt in den USA investieren und mehr US-Flüssigerdgas importieren. Konkrete Details der Vereinbarung, etwa EU-Zollanpassungen, stehen noch aus.","【经济】
美欧关税协议重创德国经济
德国总理默茨警告称，美欧新关税政策将对德国出口经济造成重大负面影响。在柏林安全内阁会议后，默茨批评了美欧达成的协议，该协议对大多数商品（汽车、半导体和药品等）征收15%关税，钢铁和铝制品等关税更维持50%高位。默茨指出，这些措施将通过贸易限制和推高通胀同时损害德美经济。
尽管默茨称谈判结果“不尽如人意”，但承认已无更好解决方案。欧盟委员会在数月谈判中成功阻止了美国原定2025年8月1日起实施的30%关税威胁。作为交换条件，欧洲企业需加大对美投资并增加液化天然气进口。协议具体细节如欧盟关税调整尚未公布。"
tagesschau,Abschiebeflüge aus Deutschland: Nicht nur Straftäter unter Abgeschobenen,2025-07-29T16:31:16.882Z,"In dem Abschiebeflug in den Irak saßen nicht nur männliche Straftäter, sondern auch Frauen und Kinder - mehr als bislang bekannt. Weitere Angaben des Bundesinnenministeriums zu Abgeschobenen werfen Fragen auf.
Mit dem jüngsten Abschiebeflug in den Irak sind mehr Frauen und Kinder nach Bagdad geflogen worden als bislang bekannt. Eine Abfrage desARD-Hauptstadtstudiosbei den Bundesländern hat ergeben, dass insgesamt vier Frauen und acht Minderjährige abgeschoben worden sind.
Neben einer jesidischen Familie mit vier Kindern aus Brandenburg,über die derrbbberichtet hatte,wurden nach Auskunft der zuständigen Landesministerien auch zwei Frauen und zwei Minderjährige aus Sachsen abgeschoben und eine Familie mit zwei minderjährigen Jugendlichen aus Nordrhein-Westfalen. Weitere Jesidinnen und Jesiden waren nach Angaben der Bundesländer nicht unter den Abgeschobenen.
Bei der jesidischen Familie aus Brandenburg kam hinzu, dass sie gegen die Ablehnung ihrer Asylanträge geklagt hatte. Eine Eilentscheidung, mit der die Ausreisepflicht ausgesetzt worden war, kam zu spät.
Heute entschied das Potsdamer Verwaltungsgericht nun in erster Instanz im Hauptsacheverfahren, dass die Familie keinen Anspruch auf Schutz hat. Das Verwaltungsgericht sah nach Angaben des Sprechers weder eine individuelle Bedrohung wie Verfolgung durch die Terrormiliz ""Islamischer Staat"" (IS) noch eine Gruppenverfolgung von Jesiden als gegeben an.
Brandenburgs Innenminister René Wilke hatte zuvor angekündigt, die Familie in Abstimmung mit den Bundesbehörden zurückholen zu wollen. Das Bundesinnenministerium wollte dafür jedoch darauf warten, dass gerichtlich festgestellt wird, ob die Familie einen Anspruch auf Schutz hat. Gegen das heutige Urteil kann noch Berufung eingelegt werden.
Zählt man die Angaben der Bundesländer zusammen, kommt man zunächst auf insgesamt 46 abgeschobene Personen. Aus Niedersachsen erfolgte allerdings einige Tage später eine Korrektur:Niedersachen habe ursprünglich acht Personen für den Flug angemeldet, am Ende seien jedoch nur vier Männer in den Irak abgeschoben worden.
Das führt zu einer Summe von lediglich 42 Personen. Thüringen - das den Flug koordinierte - sowie die Bundespolizei bleiben allerdings dabei, dass 43 irakische Staatsangehörige zurückgeführt worden seien. Bei einer der Angaben muss also ein weiterer Fehler stecken.
Abgeschoben wurden in den Irak - nach derzeitigen Angaben der Bundesländer - auch 14 verurteilte Straftäter. Wobei manche Bundesländer zunächst davon sprachen, dass die Abgeschobenen ""strafrechtlich in Erscheinung getreten"" seien. Für die Beantwortung der Nachfrage, was sie darunter verstehen, ob es für diese Kategorisierung eine strafrechtliche Verurteilung braucht oder bereits strafrechtliche Ermittlungen ausreichen, benötigten die Bundesländer teils mehrere Tage. Im Ergebnis verstehen sie darunter ""strafrechtlich verurteilt"".
Ob auch das Bundesinnenministerium, das diese Formulierung in seiner Pressemitteilung zum Abschiebeflug nach Afghanistan nutzte, das so versteht, bleibt trotz mehrfacher Nachfragen unbeantwortet. Die vage Antwort, die mit Verspätung kommt, lässt eher vermuten, dass dem nicht so ist: Alle Abgeschobenen seien ""bereits im Zusammenhang mit einem Strafverfahren auffällig geworden"", so das Bundesinnenministerium.
Dabei sagte Innenminister Alexander Dobrindt (CSU) selbst anlässlich des Flugs nach Kabul im Interview desARD-Morgenmagazins: ""Es geht dabei um schwere und schwerste Straftäter."" Und er lässt sich auch in der Pressemitteilung seines Hauses schriftlich mit den Worten zitieren: ""Es ist gelungen, einen weiteren Abschiebeflug mit Straftätern nach Afghanistan zu organisieren. (...) Es gibt kein Aufenthaltsrecht für schwere Straftäter in unserem Land.""
Das ist so verstanden worden, dass nur Straftäter nach Afghanistan abgeschoben worden sind. Das heißt, Menschen, die wegen einer Straftat von einem Gericht verurteilt wurden. Wobei Dobrindt - wenn man genau zuhört und liest - nicht sagt, dass alle 81 Abgeschobenen Straftäter waren. Man könnte ihn auch so verstehen, dass sich unter den Abgeschobenen eben auch Straftäter befanden. Es seien lediglich alle ""strafrechtlich in Erscheinung getreten"".
Die klare Kante, die Dobrindt mit seiner Wortwahl suggeriert, ist aus einem weiteren Grund nur vermeintlich klar. Denn sie wirft direkt die nächste Frage auf: Was versteht er unter ""schweren und schwersten"" Straftätern? Nur Mörder und Sexualstraftäter oder auch Ladendiebe?
Was der eine für eine ""schwere oder schwerste"" Straftat hält, ist für den anderen nicht so schwerwiegend. Zur rechtlichen Kategorie wird die Beschreibung erst dann, wenn Bezug genommen wird auf im Strafgesetzbuch geregelte Differenzierungen, zum Beispiel zwischen schwerer und einfacher Körperverletzung.
In den Irak wurden - anders als nach Afghanistan und Syrien - in den vergangenen Jahren regelmäßig Menschen abgeschoben. Ein schriftliches Abkommen zwischen Deutschland und dem Irak zu Rückführungen gibt es nicht. Die Zusammenarbeit erfolgt im sogenannten vertragslosen Verfahren und richtet sich nach dem völkerrechtlichen Grundsatz, wonach jeder Staat verpflichtet ist, seine eigenen Staatsbürger formlos zurückzunehmen, wenn diese im Gaststaat über kein Aufenthaltsrecht verfügen. Dazu führt die Bundesregierung nach eigenen Angaben Gespräche.
Die Zahl der Abschiebungen in den Irak ist zuletzt stark gestiegen. Während sie 2021 und 2022 noch im zweistelligen Bereich lag, wurden 2023 300 Menschen in den Irak abgeschoben, 2024 699 und in den ersten drei Monaten 2025 157.
Inwieweit darunter Jesidinnen und Jesiden sind, wird von der Bundesregierung nicht systematisch erfasst. Der Bundestag hatte 2023 Verbrechen der Terrormiliz ""Islamischer Staat"" (IS) im Jahr 2014 an den Jesidinnen und Jesiden als Völkermord anerkannt. Die Terrormiliz zielte auf die Vernichtung der vor allem in der nordirakischen Sindschar-Region lebenden Minderheit ab. Zehntausende Menschen wurden getötet, verschleppt, versklavt und misshandelt. Abschiebungen von Jesidinnen und Jesiden in den Irak sind deshalb sehr umstritten.
Mit den Abschiebeflügen der vergangenen Tage machen die Bundesregierung und die Bundesländer öffentlichkeitswirksam das, was sie sich vorgenommen und immer wieder angekündigt haben: abschieben.
Während öffentlich der Eindruck entsteht, es träfenur Straftäter, ist die Linie eigentlich eine andere. Selbst für Abschiebungen nach Afghanistan und Syrien heißt es im Koalitionsvertrag lediglich: ""beginnend"" mit Straftätern und Gefährdern.",https://www.tagesschau.de/inland/innenpolitik/abschiebungen-irak-afghanistan-100.html,"Mehr Frauen und Kinder bei Abschiebeflug in den Irak betroffen – Unklarheiten über Straftäter-Kriterien
Der jüngste Abschiebeflug in den Irak betraf mehr Frauen und Kinder als zunächst angenommen. Laut einer Abfrage des ARD-Hauptstadtstudios wurden vier Frauen und acht Minderjährige abgeschoben, darunter eine jesidische Familie aus Brandenburg, die trotz laufender Klage gegen ihren Asylbescheid zurückgeführt wurde. Das Potsdamer Verwaltungsgericht entschied später, dass kein Schutzanspruch bestehe, da weder individuelle Verfolgung durch den IS noch Gruppenverfolgung von Jesiden vorlägen. Brandenburgs Innenminister René Wilke (Linke) hatte eine Rückholung erwogen, doch das Bundesinnenministerium unter Alexander Dobrindt (CSU) pochte auf eine gerichtliche Klärung.
Insgesamt wurden 42–43 Personen abgeschoben, darunter 14 verurteilte Straftäter. Die Definition „strafrechtlich in Erscheinung getreten“ sorgte für Verwirrung: Während einige Bundesländer Verurteilungen meinten, blieb das Bundesinnenministerium vage und sprach von „auffällig gewordenen“ Personen. Dobrindts Aussagen zu „schweren Straftätern“ bei früheren Abschiebungen nach Afghanistan werfen Fragen auf, ob ähnlich strenge Kriterien für den Irak gelten.
Die Zahl der Abschiebungen in den Irak stieg von 300 (2023) auf 699 (2024) und bereits 157 im ersten Quartal 2025. Kritisch bleibt die Lage jesidischer Abgeschobener: Der Bundestag hatte IS-Verbrechen an Jesiden 2023 als Völkermord anerkannt. Abschiebungen in den Irak erfolgen ohne bilateralen Vertrag, basierend auf völkerrechtlichen Pflichten. Die Bundesregierung betont ihre Linie, doch die Praxis zeigt Diskrepanzen zwischen öffentlicher Darstellung und tatsächlichen Kriterien.","【社会】
德国向伊拉克遣返航班涉及多名妇孺，犯罪者定义引争议
德国最新一班伊拉克遣返航班披露更多细节，涉及妇孺数量远超预期。据德国电视一台（ARD）调查，被遣返的42-43人中包括4名女性、8名未成年人，其中一户来自勃兰登堡州的雅兹迪家庭虽仍在行政诉讼期间，但也被强制离境。波茨坦行政法院裁定该家庭不符合庇护条件，认为其既未面临“伊斯兰国”的个人迫害，也不属于受迫害的雅兹迪群体。尽管勃兰登堡内政部长考虑撤回遣返令，但德国联邦内政部坚持需等待司法裁决。
争议焦点在于此次被遣返的14名“有犯罪记录者”的认定标准：联邦内政部模糊使用“行为异常”表述，与部分联邦州要求的“刑事定罪”标准存在冲突。德国内政部长多布林特此前将阿富汗遣返者称为“重罪犯”的表述，引发对伊拉克遣返是否采用同样严苛标准的质疑。
数据显示，德国对伊拉克遣返人数从2023年300人激增至2024年699人，2025年首季度已达157人。值得注意的是，德国联邦议院2023年认定“伊斯兰国”对雅兹迪人实施种族灭绝，而当前遣返行动仅基于国际法基本原则，缺乏双边协议。舆论批评联邦政府公开表态与实际执行标准存在明显偏差。"
t-online,Grüne-Jugend-Chefin Nietzard geht – und rechnet ab,2025-07-29T16:35:00.000Z,"Mit ihren Wortmeldungen löste sie immer wieder Kontroversen aus. Nun will Grüne-Jugend Chefin Jette Nietzard nicht erneut kandidieren. Selbstkritik ist aber nicht der Grund.
Unter heftigen Vorwürfen gegen Mitglieder ihrer eigenen Partei hat die Co-Chefin der Grünen Jugend, Jette Nietzard, ihren Rückzug angekündigt. Beim Bundeskongress der Grünen-Nachwuchsorganisation Mitte Oktober inLeipzigwill sie sich nicht erneut als sogenannte Bundessprecherin zur Wahl stellen. Das teilte die 26-Jährige im sozialen Netzwerk Instagram mit. Sie bleibe aber Parteimitglied und Mitglied der Grünen Jugend.
""Allerliebste Grüne Jugend"", begann Nietzard ihre knapp dreiminütige Video-Botschaft. ""Ich habe die letzten neun Monate versucht, eine linke Hoffnung, eine linke Stimme in den Grünen zu sein.""
Bei den Grünen seien ihre Gedanken nicht immer auf Gegenliebe gestoßen, sagte Nietzard. ""Mal wurde ich in Fraktionssitzungen ausgebuht, mal wurde ich von Realo-Spitzenpersonal angeschrien oder von Ministerpräsidenten oder solchen, die es werden wollten, wurde mein Rücktritt gefordert"", sagte sie in Anspielung auf den baden-württembergischen Grünen-MinisterpräsidentenWinfried KretschmannundCem Özdemir, der ihm nachfolgen will.
""Ganz ehrlich, das sollte nicht der Alltag von der Grünen-Jugend-Sprecherin sein."" Seit einiger Zeit sei klar, dass sie ""in diesem Bundesvorstand"" der Partei keine Zukunft haben könne. ""Bei ständigen Anfeindungen kann einfach keine gute Politik entstehen und wenn die Parteispitze es nicht schafft, dass diese Anfeindungen enden, dann ziehe ich eben die Konsequenzen für meinen Jugendverband"", resümierte Nietzard.
Parteichef Felix Banaszak erklärte, eine grüne Partei müsse Interesse an einer Jugendorganisation haben, die mit ihr kontrovers über den richtigen Kurs streite. ""Dass Jette Nietzard und ich dazu in kommunikativer, strategischer und auch inhaltlicher Hinsicht meistens unterschiedliche Auffassungen hatten, ist kein Geheimnis. Das ändert nichts an meinem Respekt vor dem Schritt, den sie jetzt geht.""
Zur Seite sprang Nietzard ihr Co-Chef Jakob Blasel. Er bescheinigte Nietzard ""persönliche Größe"" und zollte ihr Respekt. Von der Partei verlangte er: ""Unsouveräne Reaktionen und toxische Empörung der letzten Wochen müssen aufgearbeitet werden."" Statt sich am eigenen Nachwuchs abzuarbeiten, müssten die Spitzen der Partei ihre Haltung grundsätzlich überdenken. ""Grüne Politik muss konsequent für soziale Politik, gegen das fossile Kartell und die Macht der Superreichen eintreten.""
Nietzard hatte mit Äußerungen in sozialen Medien immer wieder Ärger und Unverständnis in den Reihen der Grünen ausgelöst. Anfang Juni entschuldigte sie sich für ein kurz zuvor hochgeladenes Video zu Gaza undIsrael. Die Grüne Jugend erklärte in einem Transparenzhinweis, in der vorherigen Version des Videos sei ""nicht deutlich genug geworden, dass der 7. Oktober ein antisemitischer Terroranschlag war"".
In der zu diesem Zeitpunkt bereits geänderten Version hatte Nietzard Medienberichten zufolge geäußert, seit dem 7. Oktober 2023 seien ""über 50.000 PalästinenserInnen und 1.200 Israelis bei militärischen Operationen umgekommen"".
Es war nicht das einzige Mal, dass Nietzard Kopfschütteln bei Grünen-Mitgliedern auslöste. Vergangene Woche äußerte sie sich in einem RBB-Podcast dazu, wie Widerstand aussehen könnte, falls eine Partei wie dieAfDin Zukunft an der Regierung beteiligt sein sollte. ""Also ist er dann intellektuell? Ist er dann vielleicht mit Waffen?"", fragte sie im ""radioeins & Freitag-Salon"". Sie wisse darauf auch keine Antwort. Aber man müsse sich gesellschaftlich die Frage stellen.
Im Mai wiederum hatte sie sich auf ihrem privaten Instagram-Kanal mit einem Pullover gezeigt, auf dem das Kürzel ""ACAB"" zu lesen war. Es steht für ""All Cops Are Bastards"". Dazu trug sie eine Kappe mit der kapitalismuskritischen Aufschrift ""Eat the rich"".
Baden-Württembergs Ministerpräsident Kretschmann hatte Nietzard zum Parteiaustritt aufgefordert. ""Ich verstehe überhaupt nicht, was die bei uns will"", sagte der Grünen-Politiker. Für die Positionen, die Nietzard vertrete, gebe es mit der Linken ein passendes Angebot im Parteienspektrum.
Grünen-Chef Banaszak nannte Nietzards Beurteilung der Polizei ""inakzeptabel"". Özdemir, Spitzenkandidat der Partei für die kommende Landtagswahl in Baden-Württemberg, kritisierte damals, bei den Grünen sei falsch, wer nicht kapiere, dass die Polizei auch Grünen-Werte verteidige.
Nietzard distanzierte sich damals ein wenig von ihrer Pullover-Aktion. Sie ""glaube nicht, dass das der richtige Weg war, um auf die Probleme aufmerksam zu machen"", erklärt sie in einem ""Stern""-Podcast. Den Pulli besitze sie ""als Privatperson"". Nietzard ist seit Oktober 2024 Co-Sprecherin der Grünen Jugend.
Es war nicht das erste Mal, dass Nietzard provozierte. So hatte sie nach Angaben von Nutzern zu Silvester in sozialen Medien gepostet: ""Männer die ihre Hand beim Böllern verlieren können zumindest keine Frauen mehr schlagen."" Der Beitrag wurde nach Kritik gelöscht.
Den Rückzug von FDP-ChefChristian Lindnernach dem desaströsen Abschneiden seiner Partei bei derBundestagswahlquittierte sie auf X mit den Worten: ""Ich freue mich, dass der Mann von@francalehfeldtjetzt kürzer tritt um ihr Karriere und Kind zu ermöglichen"". ParteikolleginRenate Künastkommentierte den Post. ""Jette, das ist unsouverän und macht Dich sehr klein"", schrieb sie.
Zu zweifelhaften Belästigungsvorwürfen gegen den Grünen-Politiker Stefan Gelbhaar erklärte Nietzard, die Unschuldsvermutung gelte vor Gericht. ""Aber wir sind eine Organisation, und wir sind kein Gericht.""
Nun betonte Nietzard: ""In der ganzen Zeit habe ich versucht, Aufmerksamkeit auf linke Themen und auf Ungerechtigkeiten zu lenken. Und auch wenn man meine Art und meinen Weg dabei vielleicht kritisieren will, egal ob bei Polizei oder bei übergriffigen Männern oder beim Rechtsruck in der Migrationspolitik: Ziel meiner Kritik waren immer Menschen in Machtpositionen, die ihrer Verantwortung halt einfach nicht gerecht wurden.""
Sie erklärte: ""Man kann vieles über mich sagen, aber auf eins werde ich immer stolz sein, und zwar, dass ich immer nach oben getreten habe und nie nach unten."" Ihrer Partei gab sie mit: ""Grüne müssen Konflikte da führen, wo sie sich für die Menschen lohnen. Das ist mit Superreichen, das ist mit Immobilienkonzernen, die halt dafür verantwortlich sind, dass unsere Scheiß-Mieten so viel zu hoch sind."" Auch mediale Kampagnen beklagte sie.
Innerhalb des grünen Meinungsspektrums vertritt die Grüne Jugend traditionell sehr linke Positionen. Wie in anderen politischen Nachwuchsorganisationen schrecken die führenden Köpfe in der Regel nicht vor Kritik am Kurs der eigenen Parteiführung zurück. Dennoch ist die Organisation auch eine Kaderschmiede: Die frühere ParteichefinRicarda Langstand einst an ihrer Spitze, ebenso ihr Nachfolger Felix Banaszak.
Nietzard war gemeinsam mit Jakob Blasel, ihrem Co-Bundessprecher, wie das Führungsamt in der Grünen Jugend heißt, im Oktober letzten Jahres mitten in einer Krise gewählt worden. Zuvor war der vorige Vorstand zurückgetreten und hatte das mit Entfremdung von den Grünen begründet, bei denen es ""mittelfristig keine Mehrheiten (...) für eine klassenorientierte Politik gibt, die soziale Fragen in den Mittelpunkt rückt und Perspektiven für ein grundsätzlich anderes Wirtschaftssystem aufzeigt"".
Die damalige Hoffnung, mit einer neuen Führungsriege könnten die Beziehungen zwischen Jugendorganisation und Partei zur Ruhe kommen, erwies sich als trügerisch. Für die Zukunft kündigte Nietzard an: ""Die Grüne Jugend verliert mich vielleicht als Sprecherin, aber ich verspreche auch, die linke Stimme zu bleiben.""",https://www.t-online.de/nachrichten/deutschland/id_100842728/gruene-jugend-chefin-nietzard-geht-und-rechnet-ab.html,"Grüne Jugend-Chefin Jette Nietzard tritt nicht erneut an – Konflikte mit Parteispitze
Die Co-Chefin der Grünen Jugend, Jette Nietzard (26), hat ihren Rückzug von der Kandidatur als Bundessprecherin bekanntgegeben. Beim Bundeskongress Mitte Oktober in Leipzig wird sie nicht erneut antreten, bleibt aber Mitglied der Partei und der Jugendorganisation. In einer Instagram-Video-Botschaft begründete Nietzard ihren Schritt mit anhaltenden Anfeindungen innerhalb der Grünen, darunter Buhrufen in Fraktionssitzungen und öffentlichen Rücktrittsforderungen von Spitzenpolitikern wie Baden-Württembergs Ministerpräsident Winfried Kretschmann und Cem Özdemir. Sie kritisierte, dass „keine gute Politik“ unter solchen Bedingungen entstehen könne.
Nietzard, die seit Oktober 2024 im Amt war, polarisierte wiederholt durch provokante Aussagen, etwa zu Polizeikritik („ACAB“-Pullover), migrationspolitischen Themen oder ihrer Israel-Gaza-Stellungnahme, die als unzureichende Distanzierung vom Hamas-Terroranschlag vom 7. Oktober 2023 kritisiert wurde. Parteichef Felix Banaszak würdigte trotz inhaltlicher Differenzen ihren Einsatz, während Co-Chef Jakob Blasel „toxische Empörung“ in der Partei anprangerte.
Die Grüne Jugend, traditionell linksorientiert, sieht sich in Konflikt mit der gemäßigteren Parteiführung. Nietzard betonte, sie werde weiter „linke Stimme“ bleiben und kritisierte Machtstrukturen wie „Superreiche“ oder „Immobilienkonzerne“.","【政治】
德国绿党青年领袖尼茨阿尔德宣布不再连任，党内路线之争激化
绿党青年组织的联席主席耶特·尼策特（26岁）宣布，她将不再竞选连任联邦发言人一职。在10月中旬于莱比锡举行的全国代表大会上，她将不会再次参选，但仍将继续保留其绿党及青年组织的成员身份。
尼策特在Instagram上的一段视频声明中解释了她这一决定的原因：在绿党内部持续遭遇敌意，包括在党团会议中被嘘，以及来自高级政治人物如巴登-符腾堡州州长温弗里德·克雷奇曼和策姆·厄兹德米尔的公开辞职呼声。她批评说，在这种环境下“无法产生良好的政治”。
自2024年10月上任以来，尼策特屡次因挑衅性言论引发争议，例如她对警察的批评（穿着印有“ACAB”标语的卫衣）、在移民政策上的言论，或是她在以色列-加沙冲突问题上的表态——她因未能明确谴责2023年10月7日哈马斯的恐袭而受到批评。
尽管在内容上存在分歧，绿党主席费利克斯·巴纳沙克仍对她的投入表示肯定，而联席主席雅各布·布拉泽尔则谴责了党内“腐蚀性的戾气”。
一向立场偏左的绿党青年组织与更为温和的党领导层之间长期存在矛盾。尼策特强调，她将继续作为“左翼之声”发声，并批评了“超级富豪”与“房地产企业”等权力结构。"
